id,text,author,link,category,date_of_publication,number_of_tokens,number_of_words_without_punctuation,number_of_types,number_of_links_inside_the_news,number_of_words_in_upper_case,number_of_verbs,number_of_subjunctive_and_imperative_verbs,number_of_nouns,number_of_adjectives,number_of_adverbs,number_of_modal_verbs,number_of_singular_first_and_second_personal_pronouns,number_of_plural_first_personal_pronouns,number_of_pronouns,pausality,number_of_characters,average_sentence_length,average_word_length,percentage_of_news_with_spelling_errors,emotiveness,diversity
31,"Movimento Ovos na Cara é a versão atualizada do Movimento Cara Pintada. A ovada recebida pelo prefeito de SP João Dória não foi um fato isolado, é o marco do lançamento do Movimento Ovos na Cara, versão atualizada do Movimento Cara Pintada da década de 1990.

Na década de 1990 os jovens de todo Brasil pintaram o rosto com tinta guaxe e foram para as ruas exigir o impeachment do então presidente Fernando Collor de Mello. Mais recentemente o Movimento Black Bloc foi as rus para depredar a fachadas de bancos e comércios de luxo para mostrar o ódio ao sistema capitalista.


Mas a grande novidade é o Movimento Ovos na Cara. Um movimento irreverente que busca arranhar a imagem pública de políticos que promovem sua fama no mudo virtual sem dar a devida atenção ao mundo real. Segundo Marcos Vicente Nolasco, 23 anos, representante do MOC na Bahia, a escolha de João Dória foi pelo fato dele andar sempre engomadinho, penteado com laquê e maquiado com Mary Kay. Queríamos mostrar a ele e aos demais políticos que existem 14 milhões de desempregados que precisam de mais atitude que de pose.

Karla Brunetti tem 19 anos e é articuladora do MOC no Rio de janeiro. Ela afirma que o movimento não tem bandeira política: Não somos de direita nem de esquerda. Somos do lado do Brasil. Se Lula vier aqui também vai tomar ovo na cara. Se o Dória vier ao Rio vai levar mais ovo. Estes caras precisam aprender que o povo tem ódio de quem faz política pelo Facebook. Fazer videozinho é fácil. Administrar levando em consideração os interesses do povo e respeitando o voto do eleitor é que são elas. Ovo na cara de todo político que levou grana da Odebrecht e da Petrobrás.

Para os integrantes do MOC o ovo necessariamente precisa estar podre. Um valor sagrado para os líderes do movimento é o respeito ao alimento. Num país onde 14 milhões de desempregados não possuem condição de alimentar suas famílias seria um desperdício criminoso jogar comida fora. Jhonny de Cesaro, 21 anos, líder do moimento em São Paulo afirma que restaurantes e mercadinhos doam os ovos que seriam jogados fora para as ações do grupo.

O próximo alvo dos manifestantes do MOC é o presidente Michel Temer. Está sendo preparada para ele uma salva de ovos podres em São Paulo. Será um verdadeiro banho de ovo. Os manifestantes estão com mais de 3.000 ovos podres para arremessar na direção do presidente e de seus aliados.",Josias Oliveira,https://afolhabrasil.com.br/politica/movimento-ovos-na-cara-e-versao-atualizada-do-movimento-cara-pintada/,politica,2017-08-08,470,421,240,0,5,69,2,126,21,15,5,0,0,21,1.81481,1928,15.5926,4.57957,0.0,0.184615,0.570071
1019,"Deputado extrapola o bom senso e chama Glória Pires e Wagner Moura de ""vagabundos da Lei Rouanet"". .  O deputado Wladimir Costa (Solidariedade/PA) é mais um entre os diversos deputados que receberam dinheiro para ""emendas parlamentares"" com o objetivo de salvar o mandato do presidente Michel Temer. Costa, que já foi acusado de fraude eleitoral, usou a tribuna da Câmara e foi além dos limites normais do bom senso. Durante a votação do impeachment de Dilma Rousseff na Câmara, o parlamentar já havia transformado a tribuna da casa em um ""circo"" [...] e dessa vez não foi diferente. O deputado, que é conhecido por seus discursos anti-petistas, decidiu direcionar seus ataques para atores e atrizes da Rede Globo [...] só que ele foi longe demais e acabou disparando alguns insultos inaceitáveis para alguém que ocupa um cargo público de tamanha importância. Não gostar do PT é uma coisa [...] promover discurso de ódio é outra coisa bem diferente! Esse parlamentar tem que ser processado por quebra de decoro. confira no vídeo abaixo:",None,https://www.diariodobrasil.org/deputado-extrapola-o-bom-senso-e-chama-gloria-pires-e-wagner-moura-de-vagabundos-da-lei-rouanet/,politica,18/07/2017,199,170,120,0,2,27,1,52,10,9,6,0,0,14,1.70588,825,10.0,4.85294,0.00588235,0.240506,0.705882
3557,"Porque o governo não manda as forças policiais para cima do MST ?. .  Na calada da noite de ontem (10/11),  Dilma e o ministro da ""in"" justiça rasgaram (autoritariamente) a Constituição ao alterar a lei de trânsito brasileira através medida provisória e proibir  os caminhoneiros de fazer uma mobilização patriótica. Sim,  é esse o nome correto [...] e não ""greve dos caminhoneiros"" como vem divulgando os órgãos de imprensa aliados ao governo comunista de Dilma e Lula. MOBILIZAÇÃO PATRIÓTICA pelo fim de um governo corrupto. Mas,  contra o MST,  a CUT e outros vermelhinhos que estão bloqueando rodovias,  invadindo propriedades produtivas e destruindo bens em todo o Brasil,  Dilma não faz nada? O pau que bate em Chico também não bate em Francisco? Será que está na hora da maioria insatisfeita DECRETAR A DESOBEDIÊNCIA CIVIL ? Será que chegaremos ao ponto de não cumprir mais as leis feitas por um congresso de bandidos ? Que presidenta é essa que governa através de decretos e medidas provisórias  ? Abaixo alguns exemplos da balbúrdia realizada com o aval do governo federal. Se você pesquisar no Google,  certamente encontrará inúmeros casos de bloqueios de rodovias feitos pela turma da Dilma. Isso pode né,  senhor ministro da justiça? Integrantes do Movimento dos Sem-Terra (MST) em Mato Grosso voltaram a bloquear trechos de rodovias no Estado  BR-070,  em Cáceres (225 km a oeste de Cuiabá) e da BR-364,  em Rondonópolis. Para impedir que os veículos trafeguem pelo local,  eles colocaram árvores,  pneus e cobram celeridade nas ações voltadas à reforma agrária. ""Está comprovado,  a fazenda Rancho Verde é improdutiva,  reforma agrária já"",  diz uma das faixas. (Blog do Romilson) Integrantes do Movimento dos Trabalhadores Sem Terra (MST) bloquearam um trecho da BR-163,  no Km 943. A interdição fica a 5 Km do município de Itaúba,  sentido Santa Helena. (Nova Edição,  com fotos Soldado Thiago/PM de Itaúba)",None,https://www.diariodobrasil.org/porque-o-governo-nao-manda-as-forcas-policiais-para-cima-do-mst-esta-apoiando-a-gangue/,politica,11/11/2015,367,312,209,1,14,42,2,100,15,19,3,0,0,13,3.4375,1522,19.5,4.87821,0.0,0.239437,0.669872
3454,"A jovem jornalista que escreveu sobre Dilma e Cunha e ganhou 100 mil likes no facebook. .  Priscila Chammas é uma jornalista que escreveu um desabafo nas redes sociais e calou a ""petralhada"" . Abaixo a postagem que já recebeu mais de 100 mil curtidas:",None,https://www.diariodobrasil.org/a-jovem-jornalista-que-escreveu-sobre-dilma-e-cunha-e-ganhou-100-mil-likes-no-facebook/,tv_celebridades,04/12/2015,49,43,34,0,0,6,0,11,3,3,0,0,0,3,1.5,200,10.75,4.65116,0.0697674,0.352941,0.790698
2042,"Senadores usavam a Polícia Legislativa para atrapalhar as investigações da PF.  A Operação da PF no senado visa coibir parlamentares que usavam a polícia legislativa para fins pessoais.  Alguns senadores orientavam os policiais do senado para procurar e destruir as escutas telefônicas que foram instaladas pela PF com autorização judicial. Fernando Collor,  José Sarney,  Edison Lobão e Gleisi Hoffmann estão entre esses senadores que tentavam impedir o trabalho da Polícia Federal. O chefe da Polícia do Senado é o Presidente do Senado! A PF está salvando o país! Curitiba espera os senadores de braços abertos!",None,https://www.diariodobrasil.org/senadores-usavam-a-policia-do-senado-para-atrapalhar-as-investigacoes-da-pf/,politica,21/10/2016,104,95,69,0,4,18,0,33,4,0,2,0,0,5,1.8,506,19.0,5.32632,0.0,0.0784314,0.726316
1220,"TV Record ignora pronunciamento de Temer e exibe pica-pau. Audiência explodiu!.  A TV Record surpreendeu (positivamente) com sua programação na tarde de hoje.  Enquanto a mídia nacional se concentrava no pronunciamento do presidente Michel ""friboi"" Temer, o canal de Edir Macedo simplesmente ignorou a coletiva. Globo, SBT, Band e diversos canais de TV por assinatura interromperam a programação habitual para transmitir o pronunciamento de vossa (kkk) excelência, o presidente. Diversos internautas parabenizaram a Record através das redes sociais. Um deles, com milhares de seguidores, postou a seguinte mensagem: ""Gente, tirem da Globo agora mesmo. Esqueçam o Michel Temer. A Record está passando pica-pau. Vamos subir a audiência deles"" Outro agradeceu: ""Pica-pau na Record. Viva o Edir Macedo! Obrigado"" Um terceiro comentou: ""Assistindo o pronunciamento de vossa excelência, o pica-pau""",None,https://www.diariodobrasil.org/tv-record-ignora-pronunciamento-de-temer-e-exibe-pica-pau-audiencia-explodiu/,tv_celebridades,21/05/2017,164,133,86,0,4,22,3,45,7,6,2,0,0,8,2.81818,723,12.0909,5.43609,0.0150376,0.19403,0.646617
1682,"Há 7 anos, o filme ""Tropa de Elite 2"" já alertava: ""O SISTEMA é foda parceiro! Ainda vai morrer muito inocente"". .  O filme foi lançado há 7 anos, em 2010. Assista os 47 segundos finais do filme e perceba como a realidade que estamos vivendo hoje em dia foi retratada com fidelidade por Padilha: ""Agora me responda uma coisa. Quem você acha que sustenta tudo? É ... e custa caro, muito caro. O SISTEMA é muito maior do que eu pensava. Não é a toa que os traficantes, os policiais e os milicianos matam tanta gente nas favelas. Não é a toa que existem as favelas. Não é a toa que acontecem tantos escândalos em Brasília [...] entra governo, sai governo e a corrupção continua. Pra mudar as coisas, vai demorar muito tempo. O SISTEMA é foda! Ainda vai morrer muito inocente""",None,https://www.diariodobrasil.org/ha-7-anos-o-filme-tropa-de-elite-2-ja-alertava-o-sistema-e-foda-parceiro-ainda-vai-morrer-muito-inocente19/,politica,19/01/2017,171,140,89,0,4,34,3,32,6,14,6,2,0,12,1.82353,594,8.23529,4.24286,0.0,0.30303,0.635714
2001,"A ""alma mais honesta de SP"" defende a ""alma mais honesta do país"": ""Se quiser,  pode usar minha casa ou minha fazenda"".  ""Nós temos que ter respeito pela biografia do Lula"".  ""Aquilo que estão dizendo sobre o ""apartamentozinho"" dele lá no Guarujá [...] eu tenho minha casa lá. Se o Lula quiser morar de graça,  pode ir,  não tem problema"" disse Maluf. E outra coisa: ""Se ele precisar de um sítio,  eu ofereço minha fazenda pra ele"" confira: (entrevista para a TV Folha)",None,https://www.diariodobrasil.org/a-alma-mais-honesta-de-sp-defende-a-alma-mais-honesta-do-pais-se-quiser-pode-usar-minha-casa-ou-minha-fazenda/,tv_celebridades,01/11/2016,112,82,60,0,2,18,4,20,3,6,4,2,1,12,3.75,349,10.25,4.2561,0.0121951,0.236842,0.731707
1205,"Perito contratado por Temer fala, fala e não convence. .  Ricardo Molina, perito contratado pelo presidente Michel Temer com o intuito de desqualificar a prova (gravação) entregue por Joesley Batista À PGR, fala, fala e não diz nada. ""Se fosse na época da fita cassete, eu poderia dizer se é uma cópia, se é original, se é editada [...] enfim, seria mais fácil."" e continua ... ""Mas como estamos na era digital, é muito difícil saber se houve ou não uma edição (adulteração)  no áudio. É provável que alguns trechos tenham sido retirados"" Molina defende a tese de que a gravação é um lixo [...] e lixo deve ser jogado fora. Ele também atacou a PGR: ""A Procuradoria é ingênua, sim. Ingênua e incompetente."" O perito de Temer é famoso pela ""tentativa de assassinato"" (ironia) ocorrido com José Serra quando o mesmo foi vítima de uma bolinha de papel que atingiu sua cabeça em 2010. Na época, ele forneceu provas (não me pergunte como) que alegavam que José Serra foi atingido por algo mais pesado. O tucano chegou a fazer uma tomografia cerebral por conta da bolinha de papel. voltando ao perito ... Molina quer condenar o gravador e absolver Temer [...] prisão perpétua para o gravador!",None,https://www.diariodobrasil.org/perito-contratado-por-temer-fala-fala-e-nao-convence/,politica,22/05/2017,252,201,134,0,3,49,3,49,13,14,8,2,0,11,1.88889,916,7.44444,4.55721,0.0,0.27551,0.666667
2671,"Macri faz ""piada"" com Papa e autoriza doação de 16.666 milhões de pesos. O ""666"" é o número da besta.  O Papa Francisco rejeitou uma doação milionária do governo argentino.  O presidente da Argentina Maurício Macri havia autorizado [via decreto] uma doação de 16, 666 milhões de pesos (1, 1 milhão de dólares) para pagar os gastos da sede local da rede mundial educativa Scholas Occorrentes,  gerida pelo pontífice. A cifra ""666""  foi considerada uma ""piada de mau gosto"" e o Papa se mostrou perplexo com a doação ""imprevista"". O 666 [de acordo com a tradição cristã] representa o número da besta,  que faz referência a satanás. Uma publicação do jornal Vatican Insider disse que ""a quantia foi considerada excessiva em tempos em que a Argentina [país do Papa] enfrenta uma delicada situação econômica"",  porém não mencionou a piadinha de mau gosto do governo Macri.",None,https://www.diariodobrasil.org/macri-faz-piada-com-papa-e-autoriza-doacao-de-16-666-milhoes-de-pesos-o-666-e-o-numero-da-besta/,economia,13/06/2016,177,146,87,0,0,19,0,46,12,3,3,0,0,3,3.44444,683,16.2222,4.67808,0.0,0.230769,0.59589
3082,"Gilmar Mendes: ""Nomeação de Lula é uma barbárie,  uma bizarrice,  um momento caricato"".  É uma bizarrice,  não se tem vergonha [...] é um momento caricato que estamos passando.  A pancada do ministro Gilmar Mendes na cabeça dos meliantes que governam o país: ""... vem o senador Delcídio do Amaral afirmar que o ex-presidente Lula era o autor intelectual do mensalão e ele agora vai ser chefe de governo. Isso é de uma bizarrice! ..."" ""O quadro se agrava. E,  agora,  temos a nomeação do ex-presidente da República para o cargo de chefe da Casa Civil. E que vem na condição de ser um supertutor da presidente da República. Deixando este tribunal (STF) muito mal,  no contexto geral. ""É preciso muita desfaçatez para obrar desta forma das instituições. É preciso ter perdido aquele limite que distingue civilização de barbárie. É atitude de barbárie o que está fazendo com as instituições"". ""Estamos diante de um dos quadros mais caricatos que a nacionalidade já tenha enfrentado. Como último lance,  busca-se o ex-presidente em sua casa em São Bernardo do Campo para dar um respiro. É quase com uma acusação que essa casa será complacente com os contrafeitos.""",None,https://www.diariodobrasil.org/gilmar-mendes-nomeacao-de-lula-e-uma-barbarie-uma-bizarrice-um-momento-caricato/,politica,16/03/2016,230,195,121,0,6,31,1,56,9,13,6,0,0,17,1.52174,908,8.47826,4.65641,0.00512821,0.252874,0.620513
3150,"Deu branco! Gabinete de Dilma está em pânico e não sabe como reagir à denúncia de Delcídio.  Após a divulgação sobre a delação de Delcídio,  o gabinete da presidência da república já está em polvorosa.  Todas as informações que serão homologadas pelo STF contém fortes provas e indícios que poderão incriminar membros do alto escalão do governo federal e vários outros parlamentares do Congresso Federal. De acordo com fontes em Brasília,  durante o depoimento para a força-tarefa da Lava-Jato,  Delcídio estava muito nervoso e quis voltar atrás das declarações várias vezes. Ele estava muito abalado emocionalmente. Após a divulgação (pela Revista Isto É) da delação do senador,  políticos ligados ao governo estão tentando se movimentar para dar uma resposta para a população. O senador revelou os bastidores da corrupção na compra da refinaria de Pasadena e disse que citará mais nomes após a homologação do acordo. Delcídio afirmou que Dilma Rousseff de atuar três vezes para interferir na Operação Lava Jato por meio do Judiciário.",None,https://www.diariodobrasil.org/deu-branco-gabinete-de-dilma-esta-em-panico-e-nao-sabe-como-reagir-a-denuncia-de-delcidio/,politica,03/03/2016,180,167,118,0,2,26,0,50,6,7,3,0,0,9,1.44444,849,18.5556,5.08383,0.0,0.171053,0.706587
1193,"Temer convoca Forças Armadas para atuar na capital. .  O presidente Michel Temer acabou de assinar um decreto convocando as Forças Armadas para reforçar a segurança em Brasília. Após várias depredações que ocorreram na tarde de hoje, Temer decidiu não correr mais riscos. Cerca de 3 prédios na Esplanada foram danificados. O governo federal ainda não fez um balanço do prejuízo material. A PM estima que aproximadamente 35 mil pessoas ainda estão na capital. Quem sabe o exército já resolve tudo de uma vez só [...] expulsa os manifestantes e os políticos! Sonhar não custa nada!",None,https://www.diariodobrasil.org/temer-convoca-forcas-armadas-para-atuar-na-capital/,politica,24/05/2017,107,94,75,0,1,20,0,22,3,11,2,0,0,6,1.18182,468,8.54545,4.97872,0.0,0.333333,0.797872
262,"Lula manda recado a Jair Bolsonaro. O ex-presidente da República Luiz Inácio Lula da Silva pretende voltar à presidência
do Brasil, isto em 2018.
Apto a tal, imediatamente lançou sua pré-candidatura e muito possivelmente será o
representador oficial da legenda 13 (PT) na disparada presidencial.
A única coisa que pode dificultar é se o petista for condenado perante a segunda
instância através do caso do tríplex no Guarujá, no qual o ex-presidente é acusado de
ter recebido o imóvel como propina e ocultado o mesmo.
A partir do momento em que assumiu que possui a vontade de se tornar presidente
de novo, o petista vem fazendo vários congressos pelo Partido dos Trabalhadores e
tem reunido a diretoria do partido, a fim de unir toda a esquerda brasileira para
eleger o futuro presidente no ano que vem.
A empolgação do ex-presidente é devidamente forte pelo ato de comandar as
pequisas presidenciais, apenas que, a cada congresso, o petista polemiza um tanto
mais.
O deputado federal Jair Messias Bolsonaro é, de longe, o maior adversário de Lula
para as eleições de 2018, pelo fato de que nas pesquisas constantemente apresentase
em segundo lugar, em alguns casos, até encontra-se na primeira posição.
No momento em que o petista é desconsiderado pela capacidade de ser preso,
Bolsonaro encontra-se em primeiro isoladamente.
Em seu último comício pelo partido Lula sem se hesitar, falou uma coisa que soou
como um aviso para o pré-candidato adversário, Jair Bolsonaro.
O ex-presidente, ao discursar a respeito de Bolsonaro, falou de uma forma
desprezadora, afirmando que a única coisa desagradável que a extrema-direita tirou
foi ""parir"" o Bolsonaro, palavra que talvez seja considerada ofensiva. Lula é o atual candidato oficial pelo PT e apenas não anunciou sua candidatura pelo
acontecido que o Tribunal Superior Eleitoral (TSE) não permite que pré-candidatos
anunciem a candidatura oficial antes do tempo certo estabelecido pelo órgão. ",None,http://www.thejornalbrasil.com.br/2017/10/lula-manda-recado-jair-bolsonaro.html,politica,2017-10-08,348,321,187,0,3,51,4,77,23,19,9,0,0,21,2.25,1585,26.75,4.93769,0.00311526,0.328125,0.582555
3515,"Em congresso do PT,  Lula demonstra obsessão: ""Seria ideal ganhar a presidência, os 27 estados e as prefeituras"".  Em matéria publicada no Globo,  Lula revelou sua verdadeira face e uma obsessão doentia pelo poder..  (por Patrícia Carvalho) Luiz Inácio demonstrou,  através de suas palavras,  que não pensa no povo,  como ele prega pelos quatro cantos do país. Não sei se a palavra ideal seria ""prega"" [...] acho que talvez a palavra ""PRAGA"" se encaixasse melhor na frase. Fugindo um pouco do assunto e ilustrando a matéria [...] Em meados de 1935/1940,  havia um ciadão alemão que era um grande líder carismático,  popular, religioso e tinha uma altíssima popularidade. Suas principais características eram: 1  Era um grande orador (muito carismático e eloqüente). 2  Era Ultra Nacionalista 3  Era Lider-Nato Alguém se arrisca a dizer o nome? Pois bem,  o cidadão de chamava Adolf Hitler. Não estou comparando Lula ao Hitler, e sim tentando mostrar que não devemos julgar um livro pela capa. Lula jamais chegará a ser um assassino como Hitler,  mas também não é o santo salvador que ela tenta vender em seus discursos ultrapassados e repetitivos. Voltando ao assunto do post [...] Se Lula quisesse um futuro digno para o Brasil,  pensaria,  e muito,  para dizer que a esquerda deve governar todo o país. Um país que se julga democrático deve unir forças de todos os lados,  sejam elas (as forças) petistas, democratas, peemedebistas,  enfim,  Lula está demonstrando um verdadeiro espírito comunista,  egoísta,  obsessivo e porque não dizer,  doentio! trecho da matéria do Globo Em um congresso nacional da juventude do Partido dos Trabalhadores,  ele afirmou que o partido precisa priorizar as eleições municipais do ano que vem. Lula também levantou suspeitas sobre as doações de dinheiro feitas ao PSDB por empreiteiros ligados à Lava-Jato. "" Quero saber se o dinheiro do PSDB foi buscado numa sacristia. Então o PSDB ia lá no cofre e pegava dinheiro limpo? Até porque tudo o que se fala tem que se ter prova. Não podemos permitir que chamem petista de ladrão""  disse. Lula também atacou o governador tucano Geraldo Alckmin (PSDB-SP) por fechar escolas no estado. Enquanto a gente está se matando para abrir mais escolas,  o governo de São Paulo está fechando. É uma contradição Ele defendeu que o partido priorize as eleições do próximo ano: Não tem 2018 se a gente não tiver 2016 ,  nós precisamos construir 2016. O ideal para um partido é que ele pudesse disputar e ganhar a presidência,  27 governadores,  prefeituras. Seria maravilhoso que só a esquerda pudesse fazer isso,  mas não é possível,  porque o povo não faz aquilo que a gente quer,  faz aquilo que ele quer.",None,https://www.diariodobrasil.org/em-congresso-do-pt-lula-demonstra-obsessao-seria-ideal-ganhar-a-presidenciaos-27-estados-e-as-prefeituras/,politica,20/11/2015,522,443,265,0,8,91,8,111,31,29,13,0,1,33,2.54839,2108,14.2903,4.75846,0.00451467,0.29703,0.598194
1075,"O diálogo vergonhoso de Temer e Joesley: ""Funcionou super bem ... eu venho aqui onze horas, meia noite..."". .  Para quem ouve a gravação abaixo, não resta a menor dúvida de que Temer indicou o ex-deputado Rodrigo Rocha Loures como seu intermediário em futuros encontros ""financeiros"" com Joesley Batista. Loures recebeu R$ 500 mil em propinas numa mala que ele mesmo devolveu à PF após ser flagrado por câmeras. Um detalhe assustador é que o executivo da JBS e delator Ricardo Saud confirmou que seria entregue 1 mala por semana .... é isso mesmo que você leu ... uma mala de R$ 500 mil por semana em troca de favores para Joesley em órgãos do governo (especificamente o CADE). abaixo a transcrição do áudio em que Temer e Joesley citam Rocha Loures: Joesley: (Inaudível) Eu queria falar como é que é, pra falar contigo, qual é a melhor maneira, porque eu vinha falando através do Geddel, eu não vou lhe incomodar, evidentemente... Joesley: Eu sei disso, por isso é que.. Temer: (Inaudível) É o Rodrigo. Joesley: É o Rodrigo? Então ótimo. Temer: (Inaudível) passar para o Meirelles (inaudível) da mais estrita confiança. Joesley: Prefiro combinar assim, se for alguma coisa que eu precisar eu falo com o Rodrigo, se for assunto desses aí... Temer: (Inaudível) Joesley: Funcionou super bem à noite ...  onze horas da noite, meia noite, dez e meia ... eu venho aqui, a gente conversa uns dez minutinhos, uma meia horinha e vai embora.",None,https://www.diariodobrasil.org/o-dialogo-vergonhoso-de-temer-e-joesley-funcionou-super-bem-eu-venho-aqui-onze-horas-meia-noite/,politica,28/06/2017,302,242,140,0,7,41,3,61,16,22,4,8,0,20,1.62162,1104,6.54054,4.56198,0.0,0.372549,0.578512
397,"Malafaia defende Bolsonaro e acaba com a Folha/SP: ""Jornalismo sujo, esquerdopatas. Vão elegê-lo no 1o turno"".  O pastor Silas Malafaia conseguiu resumir, em pouco mais de 1 minuto, a palhaçada que a grande mídia tem feito contra o deputado Jair Bolsonaro.  Todos sabem que FHC, Lula e Dilma foram muitos generosos com os grandes grupos de mídia. Para se ter uma ideia, somente o grupo da Folha de SP chegou a receber mais de R$ 200 milhões durante as gestões petistas. ( saiba mais ... ) Outros veículos de comunicação (como a Veja, a Época, a Exame e outros) também se fartaram de ""patrocínios públicos"" durante anos. Eis que agora, com os cofres vazios, eles decidiram investir contra a candidatura de Jair Bolsonaro. Na última semana, a Folha de SP publicou uma matéria para tentar ludibriar os eleitores brasileiros. E o mais impressionante é que todas as outras grandes mídias também entraram nesse barco furado. Malafaia conseguiu resumir bem o que aconteceu: ""Eu não sou advogado do Bolsonaro, mas a Folha juntou o patrimônio de toda a família do deputado para dar uma ideia de grandeza nos imóveis da família [...] para tentar (de uma forma malandra) colocar dúvida sobre a integridade do cara. O Próprio Rodrigo Janot (ex-PGR) já havia recebido essa denúncia e arquivado por falta de provas. Que jornalismo é esse? Depois reclamam das redes sociais""",None,https://www.diariodobrasil.org/malafaia-defende-bolsonaro-e-acaba-com-a-folha-sp-jornalismo-sujo-esquerdopatas-vao-elege-lo-no-1o-turno/,politica,09/01/2018,269,228,154,1,6,33,1,64,16,14,3,1,0,19,2.27778,1078,12.6667,4.72807,0.0,0.309278,0.675439
