id,text,author,link,category,date_of_publication,number_of_tokens,number_of_words_without_punctuation,number_of_types,number_of_links_inside_the_news,number_of_words_in_upper_case,number_of_verbs,number_of_subjunctive_and_imperative_verbs,number_of_nouns,number_of_adjectives,number_of_adverbs,number_of_modal_verbs,number_of_singular_first_and_second_personal_pronouns,number_of_plural_first_personal_pronouns,number_of_pronouns,pausality,number_of_characters,average_sentence_length,average_word_length,percentage_of_news_with_spelling_errors,emotiveness,diversity
1817,"Wyllys diz que está sendo punido por ser homossexual. Não Jean, você está sendo punido porque não teve decoro.  Ricardo Izar (PP-SP) e Jean Wyllys (PSOL-RJ) tiveram um bate-boca feio no início da noite de hoje (14) no plenário da Câmara.  (Karen Barbosa  Jornalista e homossexual com orgulho  para o Diário do Brasil) Acusado de quebra de decoro parlamentar por ter cuspido em Jair Bolsonaro, Jean Wyllys é alvo de um parecer do deputado Izar que pede a suspensão de seu mandato por quatro meses. Jean disse, durante a discussão de hoje, que está sendo punido por ser homossexual. Não caro Jean! Vossa excelência está sendo punido porque não teve decoro, porque é porco e porque usa o homossexualismo para se promover como figura pública. Enfim, está sendo punido porque é um ser humano desprezível e um péssimo parlamentar para o Brasil. Pare de fazer papel de vítima caro parlamentar. O povo não é bobo!",None,https://www.diariodobrasil.org/wyllys-diz-que-esta-sendo-punido-por-ser-homossexual-nao-jean-voce-esta-sendo-punido-porque-e-porco-e-nao-teve-decoro/,politica,14/12/2016,181,158,91,0,4,33,0,41,9,10,11,0,0,6,2.55556,720,17.5556,4.55696,0.0,0.256757,0.575949
602,"Tremor de terra de 2.9 graus é registrado em área de lançamento de mísseis na Coreia do Norte.  Neste fim de semana, temores de um novo teste de bomba de hidrogênio voltaram a assustar o mundo.  Um terremoto de magnitude 2,9 foi registrado próximo a Punggye-ri, local de testes nucleares utilizado pelo ditador Kim Jong-un. Ainda não há relatos oficiais que possam confirmar se houve um possível lançamento de artefato nuclear. Com a explosão ocorrida no mês passado, que foi quantificada como dez vezes maior do que a explosão de Hiroshima (em 1945), as placas tectônicas em torno desta área de testes provavelmente foram enfraquecidas, o que pode ter causado o tremor de terra, porém um novo lançamento não pode ser totalmente descartado, informou a CBS News . Especialistas civis disseram à CBS News que a Coréia do Norte poderá ser obrigada a abandonar o local de testes. Kane Yull Sah, professora de engenharia nuclear da Universidade Nacional de Seul, descreveu a detonação da bomba H da Coreia como: Além do terreno enfraquecido, Sah diz que há o risco de uma erupção vulcânica no Monte Paektu, que fica a cerca de 60 milhas de distância. O vulcão entrou em erupção (pela última vez) em 1903. Kiom So-gu, pesquisador-chefe do Instituto de Sismologia da Coréia, disse à NBC News :",None,https://www.diariodobrasil.org/tremor-de-terra-de-2-9-graus-e-registrado-em-area-de-lancamento-de-misseis-na-coreia-do-norte/,sociedade_cotidiano,15/10/2017,244,223,142,1,4,34,1,59,14,7,11,0,0,6,2.1,1033,22.3,4.63229,0.0,0.225806,0.636771
953,"Venezuelano grava vídeo e mostra o plano diabólico do PT: ""Querem transformar o Brasil numa Venezuela"". .  Ouça (e leia) com atenção o que diz esse cidadão venezuelano: ""Ficamos 16 anos esperando e as Forças Armadas não fazem nada. A primeira coisa que um regime comunista faz quando assume um governo é trocar o comando dos militares [...] eles colocam ""militares comunistas"" no comando e uma intervenção passa a ser algo praticamente impossível de se acontecer"" ""O comunistas são muito hábeis para simular. Eles jamais fazem o serviço sujo. Eles criam grupos armados que atuam (para eles) fora da lei"" ""Eles mudam as leis para se perpetuarem no poder e para poder movimentar o dinheiro do país como querem""",None,https://www.diariodobrasil.org/venezuelano-grava-video-e-mostra-o-plano-diabolico-do-pt-querem-transformar-o-brasil-numa-venezuela/,politica,07/08/2017,141,117,90,0,1,29,2,25,9,7,2,0,0,14,2.66667,563,13.0,4.81197,0.0,0.296296,0.769231
2987,"Oficial da Reserva avisa: ""Se a lei do impeachment falhar,  partiremos para a desobediência civil "".  O comentário foi publicado numa postagem da revista IstoÉ,  em uma rede social.  Vale a pena dar uma lida: E SE O IMPEACHMENT FALHAR? Se o Impeachment falhar,  teremos que fazer greve geral [...] como na Venezuela! Desobediência civil! Se formos em multidão para as avenidas das principais das cidades e nos sentarmos no asfalto e impedir o trânsito que ocorrerá? Se fizermos Moratória dos Impostos,  como se sustentarão? É nossa chance de tomar as rédeas do nosso destino nas mãos? Quem vai mandar desobstruir as avenidas com milhares de pessoas de bem,  pacíficas,  em desobediência civil? Vão mandar a PM? A PF? A Força Nacional de Segurança cujo comandante se demitiu dizendo que não compactua com gente inescrupulosa? Vão mandar o Exército? Essas tropas estão ao lado da lei e da ordem e como Oficial da Reserva arriscaria minha vida em dizer que frente a protesto pacífico,  legítimo e ordeiro,  de desobediência civil,  se recusariam a cumprir ordem de repressão,  por absurda e injusta! Muito provavelmente ficariam ao lado do povo! Lembram do pequeno chinês que (sozinho) parou uma coluna de tanques? É desta força moral que falo! Nos liberaremos com ou sem os políticos! Que isso fique claro! Que venham os vermelhos! Por aqui não passarão!",None,https://www.diariodobrasil.org/oficial-da-reserva-avisa-se-a-lei-do-impeachment-falhar-partiremos-para-a-desobediencia-civil/,tv_celebridades,05/04/2016,262,222,152,0,6,39,6,57,12,9,3,0,2,15,6.66667,1075,37.0,4.84234,0.0,0.21875,0.684685
2720,"Lava-Jato vai investigar captadores da Lei Rouanet. Ator ""cuspidor oficial do PT"" poderá ser um dos alvos.  A força-tarefa da Operação Lava Jato,  na República de Curitiba vai,  irá investigar os incentivos culturais do País atrvés da Lei Rouanet.  Eduardo Mauat [delegado do PF] encaminhou ofício ao Ministério da Transparência Fiscalizaçãosolicitando detalhes sobre os 100 maiores captadores de recursos via Lei Rouanet desde 2006. O "" cuspidor oficial do PT "",  o ator José de Abreu,  poderá ser um dos alvos Lava Jato nessas investigações. Através de uma entrevista no Domingão do Faustão,  Abreu foi esnobe e disse que não depende da Lei Rouanet para sobreviver,  porém revelou que já teve duas peças financiadas pela mesma. O financiamento de atores ""íntimos de Lula e Dilma"" e de ideologias comunistas se tornou um símbolo nos governos petistas e uma forma de facilitar a Cultura de acordo com os interesses do PT. A força tarefa da Lava-Jato irá investigar se,  além do alinhamento ideológico,  não existiram casos de corrupção e desvios de recursos destinados a produções culturais para enriquecimento ilícito.",None,https://www.diariodobrasil.org/lava-jato-vai-investigar-captadores-da-lei-rouanet-ator-cuspidor-oficial-do-pt-podera-ser-um-dos-alvos/,politica,03/06/2016,200,179,112,1,4,24,0,55,11,6,5,0,0,4,2.33333,905,19.8889,5.05587,0.00558659,0.21519,0.625698
1994,"A maior vergonha da TV brasileira dos últimos tempos. Apresentadora fala palavrão cabeludo ao vivo.  Depois do Cardozão (ex-advogado de Dilma) citar o jurista ""Tomás Turbando"",  a gafe da vez foi da jornalista Maria Beltrão.  No último domingo (30) a apresentadora do programa Estúdio I (do canal Globo News) estava concentradíssima na cobertura das eleições quando [...] de repente [...] uma participação inusitada de um internauta chamou atenção. Beltrão foi ler a ""tal"" participação (que foi feita através do twitter) confira você mesmo: leia também:",None,https://www.diariodobrasil.org/a-maior-vergonha-da-tv-brasileira-dos-ultimos-tempos-apresentadora-fala-palavrao-cabeludo-ao-vivo/,tv_celebridades,01/11/2016,108,84,71,2,2,11,2,28,7,6,2,0,0,4,2.18182,436,7.63636,5.19048,0.0,0.333333,0.845238
2803,"Ministro do STF descobre escuta debaixo de sua mesa.  Colocaram uma escuta dentro do gabinete de um ministro do STF. A que ponto chegamos!.  A matéria diz que a  escuta foi descoberta pela secretaria de segurança do Supremo Tribunal Federal. Os microfones foram descobertos durante uma uma varredura de rotina nos gabinetes ministros e estavam instalados no gabinete do ministro Luís Roberto Barroso,  debaixo da mesa. A divulgação do fato foi autorizada pelo próprio ministro Barroso. O STF ainda não se pronunciou oficialmente. (A informação é de Leandro Mazzini do portal UOL)",None,https://www.diariodobrasil.org/ministro-do-stf-descobre-escuta-debaixo-de-sua-mesa/,politica,17/05/2016,103,92,65,0,4,14,0,32,0,3,3,0,0,4,1.375,473,11.5,5.1413,0.0,0.0652174,0.706522
2095,"Ivete interrompe show e explica para seus fãs sobre o ""pó branco"" que ela inalou: ""Vou processar os caluniadores"".  Ivete Sangalo,  durante um show que fez em São Paulo na madrugada de hoje (9),  esclareceu ao Brasil qual é a substância branca que ela inala antes de seus shows.  Vídeos e matérias maldosas foram publicadas com o intuito de denegrir a imagem da artista. No último dia 5 ,  começou a rodar nas redes sociais um vídeo em que Ivete Sangalo aparece colocando uma substância branca dentro do nariz. O vídeo mostra que a ""tal substância branca"" estava dentro de um copo descartável. ""O copo continha soro fisiológico,  indicado pela fonoaudióloga da artista,  doutora Janaína Pimenta. O produto ajuda na hidratação das cordas e na melhora da performance vocal."" Pessoas maldosas usaram o fato para tentar destruir a carreira de uma das artistas mais brilhantes que a Bahia já produziu! Ivete decidiu se manifestar. Usando um copo semelhante ao que aparece no vídeo maldoso,  a cantora parou o o show e desabafou: ""O que está me me incomodando é o fato irresponsável que as pessoas trabalham com a responsabilidade alheia. Uma coisa é quando alguém faz uma brincadeira [...] Eu não admito que tratem de forma irresponsável o meu modo responsável de viver [..] tenho um filho de sete anos e milhões de fãs mirins,  crianças,  adolescentes,  a quem eu devo todo meu respeito e meu carinho."" disse. confira no vídeo abaixo:",None,https://www.diariodobrasil.org/ivete-interrompe-show-e-explica-para-seus-fas-sobre-o-po-branco-que-ela-inalou-vou-processar-os-caluniadores/,tv_celebridades,09/10/2016,281,239,155,1,0,45,2,61,19,7,3,4,0,24,2.47059,1133,14.0588,4.74059,0.0,0.245283,0.648536
1249,"Empresa de inteligência americana alerta: ""O mundo deve estar preparado para uma nova guerra"".  O fundador da empresa de inteligência norte-americana Stratfor, George Friedman, disse em entrevista à publicação da Business Insider que o mundo deve estar preparado para uma nova grande guerra.  De acordo com Friedman, não houve um único século na história mundial sem houvesse uma guerra que ""colocasse em choque toda a ordem mundial"". ""A Guerra dos Sete Anos na Europa, as guerras napoleônicas do século XIX, as grandes guerras mundiais  cada século teve um conflito específico. ""Quer apostar que neste século não haverá algo? Aceitarei"", disse o analista de inteligência. Friedman explicou como começam as tais guerras sistêmicas. Quando países como a Alemanha, Rússia e China entram em decadência, o seu lugar é ocupado por outros. O perigo desta situação é que os novos países ""ainda não atingiram o equilíbrio"". ""Em 1871, foi a reunificação da Alemanha que causou um ""inferno"". No início do século XX, o Japão aumentou o seu poderio e depois tornou-se em um caos"", exemplificou. ""Agora também observamos uma outra mudança sistêmica. Estejam preparados para uma guerra!"", concluiu Friedman. Na sua opinião, a mesma situação descrita de substituição da liderança de uns países por outros não é perigosa. O que é perigoso é a posição que os novos países assumem. Friedman explica que os territórios principais onde podem ser iniciados conflitos são o Japão, a Polônia e a Turquia. São os países que provavelmente substituirão as potências que estão perdendo a sua influência. Assim, Friedman prediz conflitos no Oriente Médio e na Europa Oriental, além de uma guerra marítima entre o Japão e os EUA. Ao mesmo tempo, na sua opinião, há pequena probabilidade de um país usar armas nucleares contra o inimigo. Seria a Coréia do Norte? libertar.in",None,https://www.diariodobrasil.org/empresa-de-inteligencia-americana-alerta-o-mundo-deve-estar-preparado-para-uma-nova-guerra17/,sociedade_cotidiano,16/05/2017,353,300,183,0,3,50,3,83,24,16,5,0,0,22,2.65,1487,15.0,4.95667,0.0,0.300752,0.61
2567,"Em mais uma entrevista confusa,  Dilma perde o rumo e diz que Lula veio da ""senzala"".  Dilma Rousseff concedeu uma entrevista ontem [27] para um grupo de jornalistas.  ""Quando se trata de entrevistas,  Dilma supera qualquer expectativa. Ela não fala coisa com coisa. Uma pessoa que se expressa como a ex-presidenta,  denota uma certa confusão mental. A fala é reflexo da forma de pensar. Dilma pensa exatamente como fala [...] e age de acordo com seus pensamentos. É por essa razão que o país chegou onde chegou"" (Patrícia Carvalho) Abaixo alguns trechos da conversa de Dilma confusa de Dilma com as jornalistas: Vera Durão : Queria saber de você como a ideia de se tornar presidente da República tomou corpo na sua cabeça. Foi uma sugestão do Lula ou você também tinha essa pretensão? Dilma Rousseff : Ô Vera,  é assim quase público e notório que eu não tinha a menor pretensão de ser presidenta,  tampouco de concorrer a nenhum cargo eletivo naquele então. Foi assim uma coisa ""espontânea muito pressionada""  conhece ""espontânea muito pressionada""? [risos] Foi isso o que aconteceu. Natalia Viana : E a senhora pensou que era importante ter a marca de ser o governo de uma mulher? Dilma : Isso é claro. Tanto é que acho que o transformador nessa história é que era o governo de um metalúrgico,  trabalhador,  operário,  ou seja,  da senzala . Vera Durão : E como foi isso na sua cabeça,  quando ele te propôs [ser candidata a presidente]? Dilma : Ah,  Vera,  eu nem lembro,  minha querida. Isso faz parte de outro mundo ,  de outra época. Natalia Viana : E quando foi que a senhora sentiu que queria fazer o seu governo? Dilma : Uai,  desde o início. Vera Durão : Você vai ao Senado se defender? Dilma : Estou avaliando. Sou do tipo de gente que avalia.",None,https://www.diariodobrasil.org/em-mais-uma-entrevista-confusa-dilma-perde-o-rumo-e-diz-que-lula-veio-da-senzala/,tv_celebridades,29/06/2016,365,297,173,0,2,54,0,76,17,28,1,2,0,34,3.2381,1358,14.1429,4.57239,0.0,0.346154,0.582492
3120,"Preso há 9 meses,  o mega empresário Marcelo Odebrecht está a 1 passo de implodir Lula e o PT.  Marcelo Odebrecht parece que resistiu o quanto pôde. Agora o mega empresário parece ter chegado ao limite de suas forças.  É o que garante o jornalista Cláudio Humberto,  dono do portal Diário do Poder e um dos jornalistas mais bem informados sobre os bastidores da política nacional. Em sua coluna Cláudio Humberto diz que Marcelo Odebrecht já estaria falando pelos cotovelos na Polícia Federal em Curitiba. Com as revelações feitas por Marcelo,  uma mega-operação da PF e outros órgãos públicos pode estar sendo armada para essa semana. O maior doador do Instituto Lula,  o maior contratante de palestras (que não existem) do ex-Presidente e um dos maiores doadores de todas as campanhas petistas desde 2002 poderá destruir de vez Lula e o PT.",None,https://www.diariodobrasil.org/preso-ha-9-meses-o-mega-empresario-marcelo-odebrecht-esta-a-1-passo-de-implodir-lula-e-o-pt-2/,politica,07/03/2016,155,144,104,0,4,23,0,38,7,6,7,0,0,12,1.375,679,18.0,4.71528,0.00694444,0.213115,0.722222
2107,"Ex-assessor de Palocci deixou a cadeia e foi internado por ""excesso de medicamentos"".  Branislav Kontic,  ex-assessor do ex-ministro Antonio Palocci,  precisou ser internado às pressas no sábado.  A PF havia informado que Brasnislav teria sido levado ao ao Hospital Santa Cruz para realizar exames. Hoje o Estadão informou que ele foi internado por ""ingerir medicamentos em excesso"". Palocci e Branislav foram presos na 35a fase da Operação Lava Jato e as prisões temporárias foram convertidas em preventivas. Ele já está de volta à cadeia. Não há prazo para que ambos presos deixem a prisão. Resta saber agora quem foi que deu esse ""excesso"" de medicamentos para Kontic. Será que ele tentou o suicídio ou será que tentaram apagá-lo?",None,https://www.diariodobrasil.org/ex-assessor-de-palocci-deixou-a-cadeia-e-foi-internado-por-excesso-de-medicamentos/,sociedade_cotidiano,03/10/2016,135,122,87,0,1,32,1,30,3,6,8,0,0,8,1.44444,591,13.5556,4.84426,0.0,0.145161,0.713115
1739,"Aconteceu em Fortaleza! Casal de hospeda em hotel beira-mar, resolve fazer amor e vira atração turística.  Em Fortaleza (CE) um casal (que estava hospedado em um hotel) decidiu fazer amor e acabou virando atração turística.  Sem perceber que estavam sendo observados, os pombinhos deixaram a porta da varanda aberta e a luz do quarto acesa. O resultado? Dezenas de pessoas se acumularam no calçadão em frente ao hotel. Homens e mulheres gritavam palavras de incentivo ao jovem casal. Nem precisa dizer que o vídeo bombou no WhatsApp né? A ""performance"" aconteceu nesta semana. leia também:",None,https://www.diariodobrasil.org/aconteceu-em-fortaleza-casal-de-hospeda-em-hotel-beira-mar-resolve-fazer-amor-e-vira-atracao-turistica12/,tv_celebridades,11/01/2017,113,96,74,2,1,25,1,30,4,3,3,0,0,2,2.42857,474,13.7143,4.9375,0.0,0.127273,0.770833
443,"Anonymous Brasil promete divulgar documentos que provam ""elo"" entre Temer, Rede Globo e Jovem Pan.  O Anonymous Brasil divulgou agora a noite, em sua página no Facebook que estará divulgando mais de seiscentas páginas de documentos.  abre aspas De acordo com o grupo, são provas que trazem uma série de atividades relacionadas ao presidente Michel Temer e seu amigo pessoal José Yunes. Além disso, eles afirmaram que os arquivos provam elos com José Roberto Marinho (Organizações Globo), Antonio Amaral de Carvalho (Jovem Pan) e vários Laranjas moradores da periferia de São Paulo. fecha aspas",None,https://www.diariodobrasil.org/anonymous-brasil-promete-divulgar-documentos-que-provam-elo-entre-temer-rede-globo-e-jovem-pan/,tv_celebridades,25/12/2017,109,94,74,2,0,13,1,32,1,4,1,0,0,7,3.0,483,18.8,5.1383,0.0,0.111111,0.787234
2100,"Delcídio entrega Lula e Dilma: ""Pode confirmar. Tudo foi gravado pelas câmeras"".  O senador Delcídio Amaral,  que já não faz mais parte do PT,  assinou acordo de delação premiada na Operação Lava Jato.  Diante da PGR,  ele citou vários nomes,  inclusive o da ""alma mais honesta do país"",  o ex-presidente Lula. Delcídio detalhou os bastidores da compra da refinaria de Pasadena pela Petrobrás e disse que citará mais nomes em seus futuros depoimentos após a homologação do acordo. A revista IstoÉ publicou detalhes da delação que teria 400 páginas e trechos do depoimento. O senador acusou Dilma Rousseff de atuar três vezes para interferir na Operação Lava Jato por meio do Judiciário. ""É indiscutível e inegável a movimentação sistemática do ministro da Justiça,  José Eduardo Cardozo,  e da própria presidente Dilma Rousseff no sentido de promover a soltura de réus presos na operação"" ,  disse Delcídio na delação,  segundo a matéria da revista. Uma das investidas da presidente Dilma passou pela nomeação do desembargador Marcelo Navarro para o Superior Tribunal de Justiça (STJ). ""Tal nomeação seria relevante para o governo"",  pois o nomeado cuidaria dos ""habeas corpus e recursos da Lava Jato no STJ"",  informou a IstoÉ. Conforme a IstoÉ,  o senador se reuniu com Navarro no Palácio do Planalto,  no andar térreo,  em uma pequena sala de espera. Fato que pode ser comprovado pelas câmeras de segurança. No STJ,  Navarro votou a favor da soltura dos empresários,  mas foi voto vencido.",None,https://www.diariodobrasil.org/delcidio-solta-a-primeira-bomba-e-entrega-lula-e-dilma-pode-confirmar-ta-tudo-gravado-pelas-cameras23a/,politica,06/10/2016,283,242,150,0,6,32,0,81,9,4,4,0,0,14,2.92857,1190,17.2857,4.91736,0.0,0.115044,0.619835
403,"Emocionante: Jovem de 27 anos morre de câncer e deixa ""lição de vida"" divulgada na internet. . ",None,https://www.diariodobrasil.org/emocionante-jovem-de-27-anos-morre-de-cancer-e-deixa-licao-de-vida-divulgada-na-internet/,tv_celebridades,08/01/2018,21,16,14,0,0,3,0,5,2,0,0,0,0,0,1.66667,73,5.33333,4.5625,0.0,0.25,0.875
3594,"Whatsapp entre dono da OAS e Cunha aponta que Michel Temer teria recebido R$ 5 milhões em propina. .  Rodrigo Janot (Procurador Geral da República) reuniu provas de que o vice Michel Temer (PMDB) recebeu R$ 5 milhões do dono da OAS,  José Adelmário Pinheiro,  um dos empreiteiros condenados no escândalo de propinas da Petrobras. O suposto pagamento a Temer está em uma das manifestações do ministro do Supremo Tribunal Federal (STF) Teori Zavascki,  que fundamentou as buscas da Operação Catilinárias,  deflagrada na semana passada. Em uma troca de mensagens via WhatsApp entre Pinheiro e Eduardo Cunha (PMDB-RJ),  aparace uma ""menção"" em que Cunha reclama que o empreiteiro pagou a Temer e deixou ""adiado"" o repasse a outros líderes do PMDB. ""Eduardo Cunha questionou o dono da OAS por ter pago R$ 5 milhões para Temer e deixado o resto da ""turma"" a ver navios,  afirmou o PGR,  conforme a reprodução feita no documento assinado pelo ministro do STF,  Teori Zavascki. Na troca de mensagens via Whatsapp,  Pinheiro pediu a Cunha ""cuidado com a análise para não mostrar a quantidade de pagamentos dos amigos"". A conversa foi encontrada no celular do dono da OAS,  apreendido em 2014. com informações da Folha",None,https://www.diariodobrasil.org/whatsapp-entre-dono-da-oas-e-cunha-aponta-que-michel-temer-teria-recebido-r-5-milhoes-em-propina/,politica,05/09/2015,237,201,120,1,14,29,2,71,3,1,3,0,0,5,4.0,958,22.3333,4.76617,0.0,0.04,0.597015
3313,"Governo petista de MG faz licitação de R$ 500 mil que inclui filé mignon e bacalhau. .  (a informação é da Rádio CBN) Mesmo com o atraso dos salários dos servidores do estado,  o governo de Minas Gerais fez uma licitação no valor de R$ 500 mil para a compra de pescados,  frios e carnes. Os produtos abastecerão os palácios Tiradentes,  Liberdade e Mangabeiras em 2016,  principalmente nas recepções para autoridades e ocasiões especiais No total,  são 11 toneladas de carne e pescado. Levando em consideração que,  em média,  uma pessoa come 250 gramas de carne por dia,  o montante seria suficiente para servir 120 convidados diariamente,  durante todo o ano. Segundo o doutor em economia e professor do Ibmec Paulo Pacheco,  a licitação está fora da realidade: ""As famílias estão piorando a sua condição de vida para se ajustar. O Estado tem que respeitar este momento e fazer exatamente a mesma coisa. Efetivamente,   demonstra um descolamento de realidade."" No portal de compras do governo,  estão detalhados os produtos adquiridos. Além de anéis de lula e filés de robalo,  salmão e atum,  constam nos lotes crustáceos variados,  como siri,  camarão e lagosta. Só de lombo de bacalhau dessalgado,  o governo de MG considerou necessário comprar 260 quilos. leia a matéria completa no site da CBN",None,https://www.diariodobrasil.org/governo-petista-de-mg-faz-licitacao-de-r-500-mil-que-inclui-file-mignon-e-bacalhau/,politica,19/01/2016,249,214,149,1,6,26,1,80,6,6,2,0,0,6,2.91667,1032,17.8333,4.82243,0.00934579,0.113208,0.696262
1294,Coreia do Norte lança mais um míssil balístico e avisa que haverá outros durante o fim de semana. . ,None,https://www.diariodobrasil.org/coreia-do-norte-lanca-mais-um-missil-balistico-e-avisa-que-havera-outros-durante-o-fim-de-semana/,sociedade_cotidiano,28/04/2017,20,18,18,0,0,3,0,3,1,1,0,0,0,2,0.666667,79,6.0,4.38889,0.0,0.333333,1.0
