id,text,author,link,category,date_of_publication,number_of_tokens,number_of_words_without_punctuation,number_of_types,number_of_links_inside_the_news,number_of_words_in_upper_case,number_of_verbs,number_of_subjunctive_and_imperative_verbs,number_of_nouns,number_of_adjectives,number_of_adverbs,number_of_modal_verbs,number_of_singular_first_and_second_personal_pronouns,number_of_plural_first_personal_pronouns,number_of_pronouns,pausality,number_of_characters,average_sentence_length,average_word_length,percentage_of_news_with_spelling_errors,emotiveness,diversity
215,"Governo vai aumentar salário de servidores públicos!
Reajuste. Michel Temer aprovou a medida provisória que são as leis que trazem reajuste aos
servidores públicos, a remuneração dos servidores acontecera em escalas entre esse
ano 2017, até 2019.
Abrange todos os servidores públicos. No caso de servidores da educação e da saúde
o reajuste será concedido entre 20 a 25% até 2019, sendo assim abrangendo cargos
comissionados e efetivos.
O aumento implicara 3,8bilhões nos cofres públicos entre esse periodo.",None,http://www.thejornalbrasil.com.br/2017/02/governo-vai-aumentar-salario-de.html,politica,2017-02-21,88,79,60,0,0,12,0,23,4,2,2,0,0,5,1.5,419,13.1667,5.3038,0.0126582,0.171429,0.759494
1045,"G20  Trump foi irônico ao elogiar o Brasil e Temer acreditou!.  Será que ninguém consegue distinguir a diferença entre uma verdade e uma ironia?.  Não é novidade para ninguém que Donald Trump não ""bate bem dos pinos"". Pois bem ... durante um rápido encontro em Hamburgo (cúpula do G20) o presidente norte-americano se ""esbarrou"" com Michel Temer  pelo caminho e foi cumprimentá-lo. Um simples aperto de mão foi suficiente para que a ""equipe publicitária"" de Temer usasse o twitter para fazer marketing. Em duas postagens feitas na manhã de hoje (8), a conta oficial do presidente Temer informou: ""Trump elogiou o desempenho da economia brasileira ... está indo muito bem"" , postou. E não parou por aí ... Temer disse ainda que sugeriu a Trump reaproximar empresários dos dois países: ""Ele gostou da ideia"" . Das duas uma: ou Trump foi irônico ao dizer que a economia brasileira vai bem ou Temer usou a criatividade para postar no twitter. Donald Trump chega a ser engraçado ... e Temer também!",None,https://www.diariodobrasil.org/g20-trump-foi-ironico-ao-elogiar-o-brasil-e-temer-acreditou/,politica,08/07/2017,198,165,110,0,2,34,1,42,10,12,4,0,0,6,1.57143,777,7.85714,4.70909,0.0,0.289474,0.666667
520,"Reflexo na viseira de astronauta mostra homem usando jaqueta e calça jeans na Lua?. .  Isso é o que diz uma nova teoria da conspiração que está literalmente ""bombando"" nas redes sociais. Divulgado originalmente pelo canal Streetcap1, o vídeo intitulado ""Reflexo na viseira do Astronauta mostra que viagem da Apollo 17 pode ter sido uma montagem de estúdio?"" tem chamado a atenção de internautas em todo o mundo. O 48o aniversário dos primeiros passos de Neil Armstrong na superfície lunar ocorreu em julho, porém diversos teóricos da conspiração em todo o mundo continuam convencidos de que tudo não passou de um fato inventado pelos norte-americanos. Eles estão convencidos de que o presidente John F Kennedy estava tão desesperado para vencer os russos na corrida espacial à lua que acabou ordenando que fosse criada uma série de filmes (em estúdios secretos) para forjar uma viagem da NASA até a superfície lunar. No vídeo, o narrador diz: ""Encontrei essa imagem. Não faço ideia se isso já foi descoberto antes [...] trata-se de uma fotografia da Lua onde existe um reflexo na viseira do astronauta e achei isso muito estranho"" ""Aparentemente o que temos aqui (no reflexo) é a figura de um humano que não usa roupas espaciais [...] é uma fotografia da Apollo 17 da década de 70"". Ele conta que houve uma disputa sobre a autenticidade da foto em 2009, mas pesquisando no Google não foi possível saber se essa imagem é real ou até mesmo quem possui os direitos autorais da tal foto. ""Você pode ver algum tipo de ... parece um homem no início da década de 1970, com cabelos longos, você sabe. Ele está vestindo algum tipo de colete ... um sapato comum [...] enfim, são roupas que não condizem com um ambiente espacial"" explicou. O narrador destaca que, até ver a imagem em questão, ele sempre acreditou que o homem (através da NASA) tinha realmente chegado até a Lua. ""Penso que conseguimos chegar à Lua, mas isso está começando a me fazer refletir:  Cadê o traje espacial desse cidadão?"" Oficialmente, a Nasa não comenta sobre reivindicações específicas de uma suposta ""farsa da lua"". Em outras ocasiões, a agência espacial já declarou veementemente que quaisquer acusações que possam contradizer os fatos não passam de boatos inventados por teóricos de plantão. Preste atenção a partir dos 00:56 segundos do vídeo abaixo: REFLECTION ON ASTRONAUTA VISOR SHOWS MAN USING JACKET AND SHOES JEANS ON THE MOON (fonte: jornal Sunday Express ) leia também:",None,https://www.diariodobrasil.org/reflexo-na-viseira-de-astronauta-mostra-homem-usando-jaqueta-e-calca-jeans-na-lua/,tv_celebridades,19/11/2017,474,409,251,1,17,77,4,109,19,31,12,1,0,33,2.16667,1956,13.6333,4.7824,0.0,0.268817,0.613692
15,"Garotinho se supera no teatro ao chutar parede e fingir que foi lesionado na cadeia.

O Globo noticiou que a Secretaria de Administração Penitenciária (Seap) informou à Vara de Execuções Penais (VEP) do Rio que Anthony Garotinho se autolesionou dentro de sua cela na Cadeia Pública José Frederico Marques, em Benfica, na Zona Norte do Rio.

O sujeitinho disse que foi agredido durante a madrugada desta sexta-feira por uma pessoa que estava com um porrete.

Bem, esse é o mesmo que deu teatro na maca meses atrás, em sua outra prisão, após a qual ele conseguiu liberdade.

Bem, ele conseguiu se mostrar como o mais repugnante de todos os políticos presos só com essas duas atitudes.

É uma figura assustadora em termos de fingimento. Psicopata é pouco pra descrever.",None,https://ceticismopolitico.com/2017/11/24/garotinho-se-supera-no-teatro-ao-chutar-parede-e-fingir-que-foi-lesionado-na-cadeia/,politica,2017-11-24,149,130,98,0,2,21,0,31,2,6,2,0,0,16,2.375,615,16.25,4.73077,0.00769231,0.153846,0.753846
587,"LAVAGEM CEREBRAL: Ex-agente da KGB mostra como o comunismo é implantado nos países.  Yuri Bezmenov vivia sob constante medo, mesmo desfrutando de um excelente padrão de vida, e decidiu escancarar o jogo.  O Russo, que fez parte da elite da KGB (em russo de Komitet Gosudarstvennoi Bezopasnosti cujo significado em português é Comité de Segurança do Estado), mostra como se destroi totalmente os valores de uma nação através da subversão dos valores, das famílias, das instituições e até mesmo dos intelectuais de um país. Na entrevista abaixo, Bezmenov cita o enraizamento da doutrina esquerdista radical nos EUA, mas os fatos podem se aplicar perfeitamente ao Brasil. Algumas frases dele são: ""Todos esses professores e esses lindos defensores dos direitos civis são um instrumento no processo apenas para desestabilizar uma nação ""Subversão ideológica é o processo legítimo, público e aberto em que medidas ativas (também chamada de guerra psicológica) são tomadas para alterar a percepção da realidade de todo cidadão a tal grau que ninguém possa chegar a conclusões razoáveis para defender seus interesses, sua família e sua pátria"" ""É um extenso processo de lavagem cerebral, que ocorre lentamente em 4 estágios: um deles é a DESMORALIZAÇÃO (corromper a moral)  algo que demora de 15 a 20 anos (*** vide governos PSDB/PT nos últimos 20 anos ***). Esse é o tempo necessário para que se possa educar uma geração de estudantes para que eles possam inserir suas ideologias nas próximas 3 gerações.",None,https://www.diariodobrasil.org/lavagem-cerebral-ex-agente-da-kgb-mostra-como-o-comunismo-e-implantado-nos-paises/,ciencia_tecnologia,17/10/2017,274,241,166,0,9,36,3,68,17,13,6,0,0,24,4.71429,1215,34.4286,5.04149,0.00414938,0.288462,0.688797
483,"Ditador, pedófilo e genocida doou US$ 1 milhão para a campanha de Lula, segundo Palocci.  A Revista Veja deste fim de semana anunciou que pretende lançar uma bomba atômica sobre a política brasileira.  De acordo com a capa da revista, que foi antecipada ontem (07), Antonio Palocci teria delatado que o PT recebeu 1 milhão de dólares do ditador Muamar al-Kadafi, morto e linchado pela população de seu próprio país em 2011. Para quem não conhece a história do ditador, basta dar um ""google"" com as palavras ""Kadafi assassino"" ou ""Kadafi abuso"", enfim, as informações não são difíceis de se encontrar. A Veja promete contar todo o relato da delação premiada que Palocci está negociando com o MPF, incluindo os recibos da doação milionária do ditador genocida para a campanha de Lula em 2002. Um detalhe: Durante sua vida, Kadafi declarou várias vezes que tinha medo de 2 coisas: da morte e do povo [...] povo esse que acabou vingando os abusos do ditador e  fazendo justiça com as próprias mãos. DICA: Se você tem assinatura da Netflix, vale a pena assistir o documentário "" Mad Dog: Inside the Secret World of Muammar Gaddafi """,None,https://www.diariodobrasil.org/ditador-pedofilo-e-genocida-doou-us-1-milhao-para-a-campanha-de-lula-segundo-palocci/,politica,08/12/2017,227,193,138,1,4,30,0,56,9,5,4,0,0,13,3.4,892,19.3,4.62176,0.0207254,0.162791,0.715026
264,"A vida de um juiz do Supremo na Suécia: sem foro privilegiado, sem imunidade e sem auxílios.  Assim como os políticos, um juiz do tribunal superior da Suécia (equivalente ao nosso STF) não tem imunidade nem foro privilegiado e pode ser processado como qualquer cidadão.  Um juiz do Supremo na Suécia pedala até a estação ferroviária e toma o trem para chegar à Corte, em Estocolmo. Ele não mora em apartamento funcional, não recebe auxílio-moradia e nem auxílio-saúde. Não goza de imunidades. Não tem foro privilegiado. Ganha entre R$ 12 mil e R$ 25 mil por mês e é proibido de aceitar viagens e presentes.",None,https://www.diariodobrasil.org/a-vida-de-um-juiz-do-supremo-na-suecia-sem-foro-privilegiado-sem-imunidade-e-sem-auxilios/,tv_celebridades,01/02/2018,121,107,73,0,3,15,0,30,9,6,3,0,0,3,1.75,482,13.375,4.50467,0.0186916,0.333333,0.682243
350,"O dia que Jô elogiou Fidel Castro e tomou uma lambada do maior jurista do país.  O apresentador Eugênio Soares tem um histórico de defender coisas que não prestam ....  O ""beijo do gordo"" deve ter milhões de motivos para defender Dilma de forma tão escancarada. Nas redes sociais, muitos têm comentado que várias de suas obras estão na ""fila de espera"" da Lei Rouanet. Obviamente, não seria nenhum esforço para Jô defender Dilma e a petralhada. Jô Soares tem uma profunda admiração por Fidel Castro, por sua luta! Qual luta? Fidel foi um assassino responsável pela morte direta e indireta de milhares de inocentes, acusados de ""não defender o socialismo"". O ídolo de Jô levou apenas miséria e escravidão para mais de 11 milhões de cubanos, que foram tratados como gado. E Eugênio Soares ainda tem ""profunda admiração"" por essa figura! Em um de seus programas, o convidado era nada mais nada menos que o dr. Ives Gandra, o maior jurista que o Brasil já viu. Jô tentou defender o ditador sanguinário na frente de Gandra e a casa caiu!",None,https://www.diariodobrasil.org/jo-elogiou-fidel-castro-e-tomou-uma-lambada-do-maior-jurista-do-pais/,tv_celebridades,21/01/2018,208,180,112,0,0,26,0,51,13,11,3,0,0,13,2.15385,819,13.8462,4.55,0.00555556,0.311688,0.622222
2252,"Cadê o Lula? PF chega para reforçar segurança no senado e ex-presidente dá um pinote!.  Aquele ditado "" Quem não deve não teme "" não combina muito com o ex-presidente petista.  Alguns agentes da Polícia Federal chegaram no Senado simplesmente para reforçar a segurança no plenário durante a sessão do impeachment e evitar futuros desentendimentos e/ou agressões entre parlamentares. Lula ficou um pouco inquieto e abandonou a sessão sem avisar seus companheiros que ali estavam. Calma Lula! Ainda não chegou a hora.",None,https://www.diariodobrasil.org/cade-o-lula-pf-chega-para-reforcar-seguranca-no-senado-e-ex-presidente-da-um-pinote/,politica,29/08/2016,90,83,62,0,1,14,0,23,3,10,1,0,0,5,1.16667,419,13.8333,5.04819,0.0,0.351351,0.746988
2485,"PORQUICE: Ana Maria derruba mosca em comida e diz que comer inseto é bom pra saúde.  Um pequeno incidente no programa ""Mais Você"" fez com que Ana Maria Braga passasse o maior vexame nas redes sociais.  Enquanto preparava um caramelo,  uma mosca caiu na massa a e apresentadora fingiu que não viu. Louro José ainda tentou avisar: ""Caiu um bichinho na panela"". Ana tentou disfarçar e disse que era um ""queimadinho"". Ela ainda argumentou que,  quando era pequena,  ouviu dizer que comer formiga era "" bom para a visão "". Internautas não perdoaram! ""Ana Maria cozinhando mosca dando ""migué"" que é um queimado. kkk. Que horror "",  twittou uma jovem. ""Ana Maria é cega ou louca. Queimadinho? É uma mosca minha filha!!!"",  respondeu outra. "" Mãe,  tem um mosca na torta da Ana Maria "",  escreveu outro.",None,https://www.diariodobrasil.org/porquice-ana-maria-derruba-mosca-em-comida-e-diz-que-comer-inseto-e-bom-pra-saude/,tv_celebridades,12/07/2016,173,132,93,0,2,33,1,37,9,6,0,0,0,7,3.15385,608,10.1538,4.60606,0.0227273,0.214286,0.704545
413,"Ex-diretor da Petrobras conta os podres do governo PT e diz que tem medo de morrer.  Uma coletânea dos depoimentos do ex-diretor da Petrobras, Paulo Roberto Costa, de tirar o fôlego de qualquer brasileiro..  Veja algumas frases colhidas em depoimentos da Operação Lava-Jato: "" Em 2020, a situação da Petrobras vai estar caótica "" "" Tecnicamente falando, a Petrobras já é uma empresa quebrada "" ** vídeo via TV Folha ***",None,https://www.diariodobrasil.org/em-video-da-pf-ex-diretor-da-petrobras-conta-todos-os-podres-do-governo-e-diz-que-tem-medo-de-morrer/,politica,09/01/2018,77,68,56,0,2,12,1,22,2,2,1,0,0,2,2.25,327,17.0,4.80882,0.0,0.117647,0.823529
2479,"FAÇA SUA PARTE! Senado disponibiliza link para brasileiros votarem pelo FIM DO FORO PRIVILEGIADO.  O site do Senado Federal abriu uma Consulta Pública sobre a PEC 10/2013,  que visa alterar os artigos 102,  105,  108 e 125 da Constituição Federal.  No espaço e-Cidadania,  o portal permite que qualquer cidadão com acesso à internet possa participar e dar seu voto. O objetivo da emenda é acabar com a prerrogativa de Foro Privilegiado para políticos em exercício nos casos de crimes comuns. A Consulta Pública quer verificar o apoio popular para um projeto de lei ou de emenda. O autor da PEC é o Senador Álvaro Dias,  do Partido Verde. Para votar a favor ou contra a PEC,  você deverá clicar aqui .",None,https://www.diariodobrasil.org/compartilhe-e-vote-senado-disponibiliza-link-para-brasileiros-votarem-pelo-fim-do-foro-privilegiado/,politica,14/07/2016,134,122,94,1,8,18,1,34,3,2,2,0,0,5,1.5,556,15.25,4.55738,0.0163934,0.0961538,0.770492
2158,"A insanidade de Lula: ""Se me prenderem,  eu viro herói. Se me deixarem solto,  viro presidente de novo"". .  (Patrícia Carvalho  Brasília) O ex-presidente tem feito uma avaliação sobre o impacto da ação da Operação Lava Jato que o levou o Ministério Público Federal a denunciá-lo durante essa semana. Pessoas de sua confiança tem dito que o PT e o governo mais ganharam do que perderam com o episódio. Parece que a doença chegou ao grau máximo. Ninguém se autoproclama líder,  herói,  mártir ou seja lá o que for. É o povo que escolhe seu líder. São fatos que tornam uma pessoa um herói. São acontecimentos históricos que transformam alguém em mártir. Lula,  sem sombra de dúvidas,  já pode ser comparado ao lunático INRI,  um cidadão com curto circuito nos neurônios e que vive se autoproclamando Jesus Cristo. Não há diferença entre os dois. Apesar de que,  se compararmos INRI com Lula,  o primeiro (lá no fundinho) deve acreditar em Deus [...] já Lula ... Ambos perderam completamente o juízo e se acham os salvadores do mundo.",None,https://www.diariodobrasil.org/a-insanidade-de-lula-se-me-prenderem-eu-viro-heroi-se-me-deixarem-solto-viro-presidente-de-novo/,politica,15/09/2016,208,176,122,0,4,33,3,48,3,11,5,3,0,21,1.6,804,8.8,4.56818,0.0,0.17284,0.693182
503,"Blogueira louca ataca novamente e chama Marcela Temer de ""piranha de luxo"". .  A blogueira e socialite Day McCarthy, que provocou a ira dos internautas ao atacar a filha do ator Bruno Gagliasso com xingamentos racistas, parece não conhecer a palavra limite . Na última segunda-feira, McCarthy também ameaçou a cantora Anitta , alegando ter um vídeo no qual a artista estaria fazendo uso de drogas. Com a ""projeção"" que ganhou após o vídeo racista contra a pequena Titi, ela continuou com as agressões e a vítima do momento é a primeira dama do Brasil. No vídeo abaixo ela bate panela, ataca o presidente Temer e ofende gravemente Marcela. Aos 28 anos, a brasileira se casou com um italiano rico e foi com ele para os Estados Unidos [...] depois se mudou para o Canadá.",None,https://www.diariodobrasil.org/blogueira-louca-ataca-novamente-e-chama-marcela-temer-de-piranha-de-luxo/,tv_celebridades,30/11/2017,152,132,99,2,0,20,0,42,7,6,2,0,0,8,1.81818,609,12.0,4.61364,0.0,0.209677,0.75
2292,"Jovem que passou a noite com Bolt ganhou 100 euros: ""Foi para o táxi. Não faço tudo por dinheiro"".  A carioca de 20 anos disse que sua vida virou um caos.  Conhecida como Jady ""Bolt"",  devido a uma noitada que teve com o campeão olímpico Usain Bolt,  a jovem disse que não recebeu nada pelo  ""affair"" com o atleta. ""Os cem euros que ganhei dele foram para pagar o táxi de volta para casa"" ,  disse Jade ao jornal ""Extra"". Ela relatou que pretende usar a situação para melhorar a vida dos filhos  um menino de 2 anos e uma menina de 1 aninho. ""Vou aproveitar as oportunidades que surgirem"" ,  disse. A jovem também comentou que não pensa em tirar proveito de Bolt,  porém já negociou um ótimo cachê para conceder entrevistas a tabloides britânicos: ""Já que aconteceu,  vou tentar realizar algumas coisas."" Ela diz que não faria qualquer coisa por dinheiro. ""Não posaria nua,  por exemplo.Não tenho coragem.""",None,https://www.diariodobrasil.org/jovem-que-passou-a-noite-com-bolt-ganhou-100-euros-foi-para-o-taxi23/,tv_celebridades,24/08/2016,194,159,109,0,0,36,1,37,7,12,2,0,0,11,2.91667,700,13.25,4.40252,0.00628931,0.260274,0.685535
3347,"É verdade que a Polícia Federal desarticulou a quadrilha da Mega-Sena?.  Quem utiliza o aplicativo WhatsApp ou navega pela internet provavelmente perdeu as esperanças de um dia ganhar na Mega-Sena.  É que uma notícia veiculada nas redes anunciava uma descoberta bombástica: a Polícia Federal havia descoberto uma fraude na Mega-Sena. Teoria da conspiração de nível rasteiro,  esta história foi compartilhada até nos confins deste país. Entretanto,  sites especializados em desfazer boatos,  como o e-farsas.com e boatos.org ,  desvendaram o mistério: isso deve ser coisa de desocupado,  que não tendo muita coisa para fazer,  tenta ludibriar os outros. A Caixa Econômica Federal também esclarece o fato aqui . E vai um aviso: antes de sair por aí compartilhando boatos,  lembre-se de que isso é antiético. Não custa nada pesquisar para proceder com a verdade. Do Brasil Post : Se você sempre teve o sonho de ganhar na Mega-Sena,  um texto que está circulando nas redes sociais desde 2013 acabou tirando todas as esperanças de muitas pessoas. O texto dá conta que a Polícia Federal desmantelou uma fraude na de pessoas ligadas diretamente ao governo na Mega-Sena. O texto aponta que a fraude estava no peso das bolinhas e botavam ""laranjas"" (pessoas pagas para ganhar) em diferentes estados. Ele também aponta que foram descoberto membros da quadrilha com fortunas de R$ 4 bilhões em paraísos fiscais. Também é dito que a imprensa foi censurada e lembrado que 45% do salário das pessoas vai embora com impostos. Leia trechos do texto: E não é que as pessoas passaram a mensagem para todos os amigos,  inimigos e até amigos dos inimigos e inimigos dos amigos. Uma das postagens sobre o assunto teve nada menos do que 285 mil compartilhamentos. É uma pena que a história é falsa.",None,https://www.diariodobrasil.org/e-verdade-que-a-policia-federal-desarticulou-a-quadrilha-da-mega-sena/,politica,06/01/2016,327,299,179,6,4,57,2,82,6,20,9,0,0,17,1.47368,1427,15.7368,4.77258,0.0133779,0.18705,0.598662
1823,"TSE tem provas suficientes para cassar Michel Temer. Novo presidente pode ser eleito por voto indireto.  O TSE já tem indícios suficientes para provar que o financiamento de campanha da chapa Dilma/Temer se beneficiou de verbas desviadas do esquema criminoso proveniente da Petrobras.  Nesse caso,  os dois teriam que ser depostos. O blog do Josias de Souza informou que tais evidências documentais e testemunhais são suficientes para cassar a chapa PT/PMDB. Como Dilma já ""rolou rampa abaixo"" no Planalto,  a bola da vez é presidente Michel Temer. Caso a chapa seja cassada pelo TSE até este mês (dezembro de 2016),  poderá haver novas eleições diretas para presidente da República. Se o julgamento for ""empurrado"" para 2017,  caberá ao Congresso Nacional apontar o nome do próximo presidente através de eleição indireta.",None,https://www.diariodobrasil.org/tse-tem-provas-suficientes-para-cassar-michel-temer-novo-presidente-pode-ser-eleito-por-voto-indireto14/,politica,14/12/2016,148,132,95,0,5,25,2,41,13,4,7,0,0,3,1.77778,667,14.6667,5.05303,0.0,0.257576,0.719697
2359,"Lula tenta desmoralizar Sérgio Moro mais uma vez. Alguém que foge da justiça merece ser presidente?.  Lula continua sem argumentos e fundamentação jurídica para se defender e busca achincalhar e desmoralizar o juiz Sérgio Moro e a justiça brasileira.  É a velha e imunda tática petista do assassinato de reputações. Se eles fazem isso com membros do próprio partido,  imaginem só o que podem fazer com terceiros! A defesa do ex-presidente reafirmou ao juiz federal Sérgio Moro que ele é suspeito para julgar o petista. Foi protocolada uma petição de 43 páginas alegando parcialidade do juiz da Lava Jato. A defesa ainda cita outros motivos que tornariam o juiz incompetente: ""Proximidade íntima com setores da imprensa  Participação em eventos organizados por inimigos políticos  Edição de 03 livros que tem por tema a pessoa do Excepto e a Operação ""Lava-Jato""  Envolvimento pessoal nos atos da fase investigatória,  com o objetivo de contaminar sua imparcialidade para decidir a causa.""",None,https://www.diariodobrasil.org/lula-tenta-desmoralizar-sergio-moro-mais-uma-vez-alguem-que-foge-da-justica-merece-ser-presidente/,politica,08/08/2016,176,159,109,0,1,27,2,47,13,3,1,0,0,14,2.125,807,19.875,5.07547,0.0,0.216216,0.685535
1914,"Morre o homem que deixou Cuba na miséria. Em 2005,  sua fortuna era estimada em US$ 550 milhões.  O ditador cubano faleceu nesta madrugada aos 90 anos em Havana.  Raúl Castro,  irmão de Fidel,  fez o anúncio num discurso transmitido pela televisão estatal cubana: ""É com profunda dor que compareço para informar ao nosso povo,  aos amigos da nossa América e do mundo que hoje,  25 de novembro do 2016,  às 22h29,  faleceu o comandante da Revolução Cubana,  Fidel Castro Ruz"",  disse Raúl Castro,  visivelmente emocionado."" Fidel ficou no poder durante 47 anos. Só se afastou em 2006,  devido a problemas de saúde e passou a liderança do regime comunista ao irmão Raúl. Em 2005,  a revista ""Forbes"" elaborou a lista das pessoas mais ricas do mundo e Fidel tinha acumulado uma fortuna de US$ 550 milhões,  dinheiro proveniente de uma rede de negócios uma rede de negócios pertencentes ao Estado. leia também:",None,https://www.diariodobrasil.org/morre-o-homem-que-deixou-cuba-na-miseria-em-2005-sua-fortuna-era-estimada-em-us-550-milhoes/,sociedade_cotidiano,26/11/2016,182,153,108,5,3,18,1,48,9,7,1,0,0,7,3.625,710,19.125,4.64052,0.0,0.242424,0.705882
1829,PEC do Teto ao vivo: Começa o quebra-pau no senado.  Começou no senado a votação da PEC do Teto em segundo turno.  Renan está com pressa e quer votar a toque de caixa. Assista ao vivo:,None,https://www.diariodobrasil.org/pec-do-teto-ao-vivo-comeca-o-quebra-pau-no-senado/,politica,13/12/2016,41,37,29,0,2,6,1,13,2,1,0,0,0,0,1.0,141,9.25,3.81081,0.0,0.157895,0.783784
1626,"Jorge Fernando, diretor da Globo, sofreu AVC e precisou ser internado às pressas no Rio. .  O susto aconteceu no último fim de semana e Jorginho foi diagnosticado com Acidente Vascular Cerebral. A pedido do próprio Jorge, o hospital não divulgou nenhum boletim médico sobre seu estado de saúde. O colunista Leo Dias informou que o diretor já recebeu alta na última sexta-feira (27) e passa bem. A Rede Globo não se manifestou sobre o assunto e não informou quando Jorge Fernando retornará.",None,https://www.diariodobrasil.org/jorge-fernando-diretor-da-globo-sofreu-avc-e-precisou-ser-internado-as-pressas-no-rio/,tv_celebridades,31/01/2017,93,83,65,1,1,14,0,21,4,8,2,0,0,4,1.42857,394,11.8571,4.74699,0.0,0.342857,0.783133
