id,text,author,link,category,date_of_publication,number_of_tokens,number_of_words_without_punctuation,number_of_types,number_of_links_inside_the_news,number_of_words_in_upper_case,number_of_verbs,number_of_subjunctive_and_imperative_verbs,number_of_nouns,number_of_adjectives,number_of_adverbs,number_of_modal_verbs,number_of_singular_first_and_second_personal_pronouns,number_of_plural_first_personal_pronouns,number_of_pronouns,pausality,number_of_characters,average_sentence_length,average_word_length,percentage_of_news_with_spelling_errors,emotiveness,diversity
2206,"Dilma não levará cão labrador para Porto Alegre. ""NEGO"" já havia sido abandonado por José Dirceu em 2005.  O cão da raça labrador ""Nego"" será abandonado mais uma vez.  O mascote de Dilma,  que participou até da propaganda eleitoral da petista em 2010,  ficará aos cuidados de um assessor da ex-presidenta. O cachorro foi abandonado na Casa Civil por José Dirceu,  em 2005. Em nota,  a petista informou que um veterinário recomendou que o cão não se submeta a uma longa viagem,  pois tem dificuldades para andar e se alimentar. Dilma está de malas prontas para Porto Alegre. Espera aí! Porto Alegre não é tão longe assim [...] ainda mais de avião. Pois é ... agora o Nego já não serve mais! Pobre cãozinho!",None,https://www.diariodobrasil.org/dilma-nao-levara-cao-labrador-para-porto-alegre-nego-ja-havia-sido-abandonado-por-jose-dirceu-em-2005/,sociedade_cotidiano,05/09/2016,146,123,80,0,1,23,1,27,6,17,3,0,0,4,1.53333,546,8.2,4.43902,0.0,0.46,0.650406
3201,"José de Abreu desabafa sobre o amigo Dirceu: ""O Dirceu tá fod#$%.Sabe que a cadeia é pra sempre"".  O ator ""comunista"" global José de Abreu disse em entrevista para a jornalista Mônica Bergamo como ele vê a prisão do amigo José Dirceu.  Ele disse que quando conversou com o amigo,  Dirceu ainda estava animado. ""Me falou que cumpriria o resto da pena do mensalão e que,  no fim do ano,  seria indultado. Queria sair do Brasil,  recomeçar a vida em outro país com a filhinha."" Quando veio a Lava Jato,  as coisas saíram do planejado: ""Ele me disse: ""Se me colocarem na cadeia,  é pra sempre. Eu não saio nunca mais""."" O ator afirmou que Dirceu comentou sobre o depoimento de Dirceu ao juiz Sergio Moro. ""Era o rei falando com o plebeu! O Moro não conhece esses meandros"" ,  afirmou. José de Abreu comentou: ""O Zé (Dirceu) é tá é fodido.""",None,https://www.diariodobrasil.org/jose-de-abreu-desabafa-sobre-o-amigo-dirceu-o-dirceu-ta-fod-sabe-que-a-cadeia-e-pra-sempre/,tv_celebridades,15/02/2016,193,152,94,1,0,35,1,42,2,9,1,4,0,9,3.41667,633,12.6667,4.16447,0.00657895,0.142857,0.618421
1371,"Rússia acusa EUA de ""plantar"" ataque químico na Síria: ""Foi assim no Iraque"".  Vladimir Putin disse hoje (11) à imprensa que Donald Trump age pelas costas.  O presidente russo afirmou que os EUA planejam atacar Damasco, capital da Síria, com o objetivo de culpar o líder Bashar al-Assad. A fala foi bem objetiva: ""Várias fontes nos informaram que os EUA planejam ações em outras regiões da Síria, incluindo Damasco. São planos de lançar ataques químicos para depois culpar as autoridades sírias"" afirmou Putin . Ele também declarou que algo similar foi feito no Iraque: ""Em 2003, eles invadiram o Iraque alegando que Saddam possuía armas químicas. Vimos o país inteiro ser destruído e até hoje nada foi encontrado"" Putin encerrou dizendo que vai denunciar os EUA à ONU para o ataque químico da última semana seja investigado: ""Iremos representar formalmente à ONU e pedir que a comunidade internacional investigue esses fatos com cautela"" concluiu.",None,https://www.diariodobrasil.org/russia-acusa-eua-de-plantar-ataque-quimico-na-siria-foi-assim-no-iraque/,sociedade_cotidiano,11/04/2017,180,154,113,0,6,39,2,42,12,7,6,0,1,9,3.25,765,19.25,4.96753,0.00649351,0.234568,0.733766
283,"Ratinho denunciou artistas que ""mamavam"" na Lei Rouanet e agora sofre ameaças de boicote.  Ratinho [apresentador do SBT] causou polêmica ao fazer um desabafo em programa.  Alguns artistas [se é que podemos chamá-los assim] estão planejando fazer uma espécie de ""punição"" ao apresentador. Eles planejam fazer um boicote e recusar convites da direção da atração para cantarem no palco do ""Programa do Ratinho"". A informação é do jornalista Fernando Oliveira em sua coluna para a Folha de S.Paulo. O apresentador disse que quem sobrevive da lei "" mama nas tetas do governo"" e denunciou alguns ""chupins"" que complementam sua renda através de verbas públicas que poderiam ser detinadas, por exemplo, para a saúde e educação. Ratinho estava certo! E quer saber? Esses supostos artistas não farão a mínima diferença no programa do apresentador! ""Se pegaram o dinheiro, eu não sei [...] mas tiveram a pouca vergonha de pedir"" disse o apresentador ""A maioria da população não sabe pra que serve e Lei Rouanet"" disse o apresentador. reveja o vídeo:",None,https://www.diariodobrasil.org/ratinho-denunciou-artistas-que-mamavam-na-lei-rouanet-e-agora-sofre-ameacas-de-boicote27/,tv_celebridades,31/01/2018,202,169,112,0,2,35,1,50,4,7,4,1,0,14,2.75,829,14.0833,4.90533,0.00591716,0.129412,0.662722
795,"""Furacão Irma será a maior catástrofe já vista nos EUA"" diz Centro de Gerenciamento de Emergências. .  O diretor Agência Federal de Gerenciamento de Emergências dos EUA, Brock Long, disse que o país passará por uma catástrofe nunca antes vista: ""O Irma devastará os Estados Unidos. Será algo de proporções épicas que colocará mais de 6 milhões de pessoas em risco"" , declarou. Na última quinta-feira (07), o governador Rick Scott ordenou a evacuação de 750 mil pessoas em Miami: ""Não poderemos salvá-los no meio da tempestade"" disse o republicano. O prefeito de Miami, Carlos Giménez, um ex-bombeiro que já passou por centenas de perigos durante sua carreira, disse que nunca viu algo tão sinistro: ""Serão ventos de mais de 250 km/h [...] um grande número de residências poderá ficar submerso."" A Marinha disponibilizou 4 navios que já estão em alerta [...] a Guarda Nacional terá quase 10 mil soldados preparados para as emergências [...] a Força Aérea terá uma esquadra de aeronaves para monitorar o furacão. Helicópteros da Guarda Costeira também estão a postos para os resgates. O Irma, durante sua passagem pelo Caribe (na quinta-feira), deixou mais de 20 mortos nas ilhas das Antilhas, Porto Rico, Saint-Martin e Barbuda. Autoridades locais informaram que mais de 90% dessas ilhas ficaram totalmente destruídas. Canal espanhol Infobae ao vivo: Canal Fox News ao vivo da Flórida:",None,https://www.diariodobrasil.org/furacao-irma-sera-a-maior-catastrofe-ja-vista-nos-eua-diz-centro-de-gerenciamento-de-emergencias/,sociedade_cotidiano,09/09/2017,268,226,156,0,2,32,0,61,11,16,2,0,0,8,2.1,1099,11.3,4.86283,0.0,0.290323,0.690265
2026,"Delações da Odebrecht estão apavorando Brasília. Além de Lula & CIA,  Michel Temer e seus ministros também são citados.  As delações premiadas da Odebrecht  (com seus 50 executivos  além do empresário Marcelo) está apavorando a capital do país.  Os jornais El País e o Globo confirmaram que as delações estão próximas da ""carimbada final"" Desta vez,  nomes como Michel Temer e os ministros Eliseu Padilha,  José Serra e Geddel Vieira Lima aparecem em meio aos documentos. As acusações contra a ""alma mais honesta deste país"" serão reforçadas. Antonio Palocci e Guido Mantega também estão incluídos nas delações. Outros 130 deputados,  senadores e ministros,  além de 20 governadores e ex-governadores de diversos partidos,  também poderão participar da ""festa"" em Curitiba.",None,https://www.diariodobrasil.org/delacoes-da-odebrecht-estao-apavorando-brasilia-alem-de-lula-cia-michel-temer-e-seus-ministros-tambem-sao-citados/,politica,26/10/2016,141,119,88,0,1,17,0,40,2,5,5,0,0,4,2.75,622,14.875,5.22689,0.0,0.122807,0.739496
179,"URGENTE: Dono da Friboi é internado em estado grave. Friboi na UTI !!! O empresário Joesley Batista, sócio do grupo JBS FRIBOI e autor da delação que gerou abertura de inquérito contra o presidente Michel Temer, foi internado no Hospital Albert Einstein, na Zona Sul de São Paulo, informou nesta quarta-feira (28) a assessoria do centro médico.

O hospital informou, por e-mail, que a família de Joesley solicitou privacidade. Questionada sobre os motivos da internação, a assessoria do Grupo JBS disse que aguardava boletim médico para dar mais informações, no entanto, sabe-se que o estado é grave. Na terça, a agência de notícias Reuters divulgou que o empresário tinha dado entrada em um hospital inconsciente e fortes alterações cardíacas.

Não está descartada a possibilidade de envenenamento. A Polícia Federal deve acompanhar de perto os laudos médicos nas próximas horas.",None,https://afolhabrasil.com.br/escandalos/urgente-dono-da-friboi-e-internado-em-estado-grave/,sociedade_cotidiano,2017-06-28,161,141,103,0,5,21,0,46,10,3,4,0,0,3,2.5,714,17.625,5.06383,0.0,0.19403,0.730496
2410,"A astúcia de Moro: ""Se não havia nada de ilícito no grampo telefônico,  então por que tanto alvoroço?"".  Em mais uma jogada de mestre,  Sérgio Moro surpreendeu a presidente afastada Dilma Rousseff.  A petista estava descontrolada após a divulgação de sua conversa com Lula. Aquela do ""termo de posse"",  lembram? Pois bem,  em um despacho divulgado no início do mês,  o magistrado surpreendeu Dilma. O ofício foi uma resposta ao ministro Teori,  que havia solicitado explicações sobre a divulgação dos grampos. Moro lamentou as controvérsias desencadeadas por sua decisão de levantar os sigilos das gravações legais e também questionou o motivo de tanto alvoroço (no meio petista) após a divulgação das conversas entre Lula e Dilma. O recado foi bastante claro: Se não havia nada de errado,  qual o motivo de tantas explicações,  de tantos berros e de tanto descontrole? Se Dilma agiu legalmente,  por que o STF não ""aprovou"" Lula como ministro? Se tudo foi feito dentro dos conformes,  por que Lula queria ser julgado pelo STF? Por qual motivo o ex-presidente estaria fugindo da primeira instância? abaixo um trecho do ofício: ""Rigorosamente,  a Exma. Sra. Presidenta da República negou,  publicamente,  o caráter ilícito do diálogo. Se é assim,  se o referido diálogo não tinha conteúdo jurídico-criminal relevante para a Exma. Sra. Presidenta da República,  então não havia causa para,  em 16/03,  determinar a competência do Supremo Tribunal Federal,  o que só ocorreria com a posse do ex-Presidente Luiz Inácio Lula da Silva no cargo de Ministro Chefe da Casa Civil,  então marcada para 22/03/2016,  depois antecipada para 17/03/2016"" ,  escreveu o juiz. URGENTE  28 DE JULHO DE 2016",None,https://www.diariodobrasil.org/a-astucia-de-moro-se-nao-havia-nada-de-ilicito-no-grampo-telefonico-entao-por-que-tanto-alvoroco/,politica,28/07/2016,322,277,164,0,4,37,0,74,13,21,4,0,0,19,3.46154,1334,21.3077,4.81588,0.00361011,0.306306,0.592058
3574,"Ministro da Justiça disse que pessoas que pedem impeachment tem ""problema de cabeça"".  Ele disse que quem pede o impeachment da presidente Dilma Rousseff (PT) tem ""problema psicológico"".  O ministro da Justiça,  José Eduardo Cardozo,  disse,  em entrevista para o Estadão,  que a oposição está usando as investigações da Operação Lava Jato politicamente,  para fazer um ""terceiro turno eleitoral"". O ministro disse que FHC se apoderou da Petrobras e foi ""conivente"" com a corrupção,  sugerindo que o ex-presidente pudesse estar envolvido nos escândalos. ""Existem pessoas que ainda não entenderam o resultado das urnas e querem o terceiro turno"",  disse Cardoso. Ao longo da entrevista,  ele tentou amenizar suas palavras,  dizendo que não estava realmente insinuando que FHC ""fechou os olhos para a corrupção"",  mas apenas que não há nenhum fato nas investigações que implique o envolvimento da presidente Dilma nos esquemas de desvio de dinheiro. Para Cardoso,  o governo do PT teve importantes avanços no combate à corrupção,  e que as investigações que existem hoje só são possíveis devido a esses avanços.",None,https://www.diariodobrasil.org/ministro-da-justica-disse-que-pessoas-que-pedem-impeachment-tem-problema-de-cabeca/,tv_celebridades,07/11/2015,205,173,111,1,4,32,2,53,5,9,3,0,0,11,4.0,890,21.625,5.14451,0.0,0.164706,0.641618
2527,"Em vídeo,  Delegado da PF (que investigava Lula) confirma que foi afastado por diretor.  Ambos são responsáveis por inquéritos ligados ao ex-presidente Lula.  Eduardo Mauat e Luciano Flores,  delegados da PF que integravam a equipe da Operação Lava Jato em Curitiba,  serão substituídos. Eles atuaram desde as primeiras etapas da operação,  inclusive nos inquéritos ligados ao nome do ex-presidente Luiz Inácio Lula da Silva. Flores foi o responsável por interrogar Lula durante o cumprimento do mandado de condução coercitiva,  em março deste ano,  no Aeroporto de Congonhas. Mauat também foi um dos responsáveis pela condução de inquéritos ligados ao ex-presidente Lula. Entre eles,  o que investiga o Instituto Lula,  a empresa LILS Palestras e o sítio em Atibaia.",None,https://www.diariodobrasil.org/em-video-delegado-da-pf-que-investigava-lula-confirma-que-foi-afastado-por-diretor/,politica,07/07/2016,135,121,79,0,3,17,0,38,5,2,2,0,0,8,1.75,620,15.125,5.12397,0.0,0.127273,0.652893
1461,"Internauta relata o ""dia da mentira"" nos frigoríficos: ""Os fiscais chegam e eles escondem a carne podre"".  Leia abaixo o relato de uma professora universitária postado nas redes sociais:.  Tenho alunos que trabalharam no ""frigorífico"" local e já ouvi de muitos sobre o que os funcionários chamam de ""Dia da mentira"". É quando eles sabem que virá a fiscalização (sim, é avisado porque os fiscais são ""vendidos"") e guardam a carne com bicheiras em caminhões baú e apresentam apenas o que foi abatido no dia [...] também dão uma higienizada no local. Quando os fiscais vão embora, as carnes são retiradas dos caminhões com muita mosca e cheiro insuportável, além das carnes que são devolvidas do exterior e chegam roxas, mas aplicam um produto para que a cor pareça ""mais agradável"" para serem vendidas no mercado local. Essas histórias eu ouço há mais de 5 anos por diversos alunos. Perguntem para quem já trabalhou lá, infelizmente só hoje veio à público, mas nunca é tarde.",None,https://www.diariodobrasil.org/internauta-relata-o-dia-da-mentira-nos-frigorificos-os-fiscais-chegam-e-eles-escondem-a-carne-podre15/,tv_celebridades,18/03/2017,196,164,117,0,1,37,3,35,9,17,6,1,0,14,2.90909,773,14.9091,4.71341,0.0,0.361111,0.713415
1832,"Colunista do Globo diz que delatores da Odebrecht estão sofrendo ameaças de morte. .  Após a primeira bomba lançada pelo ex-executivo da Odebrecht,  Cláudio Melo Filho,  envolvendo 51 políticos e 11 partidos,  as ameaças começaram a acontecer. Uma longa lista com diversos políticos envolvidos em recebimento de propinas,  seus respectivos apelidos e os valores recebidos foi divulgada em toda a rede. A PF tem que cuidar da proteção desses delatores ou eles começarão a sumir [...] um a um.",None,https://www.diariodobrasil.org/colunista-do-globo-diz-que-delatores-da-odebrecht-estao-sofrendo-ameacas-de-morte/,tv_celebridades,13/12/2016,89,78,63,0,1,14,0,21,6,1,5,0,0,6,1.22222,393,8.66667,5.03846,0.0,0.2,0.807692
3600,"Mulher bêbada invade Planalto e diz que é ""marido"" da presidente Dilma.  Uma mulher de 29 anos identificada como Edmeire Celestino da Silva invadiu o Palácio do Planalto e foi contida pelos seguranças presidenciais.  Edmeire estava bêbada e gritava que queria se casar com a presidente Dilma. A moça ignorou tiros de balas de borracha dados como advertência e trocou socos com um dos seguranças. Totalmente confusa,  a cidadã gritou até ficar rouca e dizia para todos que era o ""marido"" da Dilma. O Corpo de Bombeiros foi chamado e encaminhou a ""esposa"" da Dilma para um albergue.",None,https://www.diariodobrasil.org/mulher-bebada-invade-planalto-e-diz-que-e-marido-da-presidente-dilma/,sociedade_cotidiano,13/09/2012,111,98,68,0,0,20,0,27,6,2,2,0,0,4,1.85714,467,14.0,4.76531,0.0,0.170213,0.693878
792,"Você usaria? Na China, mulheres aderem à meia calça com pêlos para afastar pervertidos. .  Trata-se de uma meia calça que imita uma perna peluda. O assessório foi criado para ser usada por mulheres e afastar maníacos e pervertidos. Na China, diversos homens ultrapassam os limites do bom senso e acabam assediando mulheres, principalmente dentro dos transportes públicos. ""Supersexy, meia cheia de pelos antipervertidos para ser usada neste verão. Essencial para as jovens que saem por aí"" , diz o anúncio do fabricante. De acordo com a marca, o produto é tão realista que pode ser confundido com uma perna masculina de verdade. Ainda não há previsão de venda no Brasil.",None,https://www.diariodobrasil.org/voce-usaria-na-china-mulheres-aderem-a-meia-calca-com-pelos-para-afastar-pervertidos/,sociedade_cotidiano,12/09/2017,127,110,80,0,0,25,0,25,12,6,6,0,0,5,1.7,540,11.0,4.90909,0.0181818,0.36,0.727273
74,"Dilma entrará na Justiça pra anular impeachment. O voto de Gilmar Mendes abriu dois caminhos jurídicos para a anulação do impeachment e o advogado da ex-presidente pretende recolocar Dilma de volta ao poder antes do final de 2017.

Após a chapa Dilma-Temer ser absolvida no Tribunal Superior Eleitoral (TSE), o advogado da ex-presidente, Flavio Caetano, afirmou que o julgamento reforça que houve golpe no Parlamento contra o Estado de Direito e a Constituição e disse que dois argumentos do ministro Gilmar Mendes poderão ser utilizados no Supremo Tribunal Federal no processo em que Dilma busca pede a anulação do impeachment.  O advogado destacou o voto de Gilmar como argumento para anular o impeachment. Houve duas manifestações hoje muito importantes do ministro Gilmar Mendes, que é presidente da Corte e ministro do STF. A primeira é a defesa do princípio da soberania do voto popular. E a segunda é que vivemos em um semiparlamentarismo, em que quem não tiver maioria no Congresso perde o cargo, disse Caetano.

Caetano disse que, com a sessão desta sexta, foi a terceira vez que a campanha foi julagada. A primeira vez foi aquela em que as contas foram aprovadas por unanimidade. Na segunda vez, reconheceu que as urnas não foram fraudadas, disse. Consideramos que a Justiça foi feita ao preservar direitos políticos de Dilma Rousseff, disse.

A ação proposta pelo PSDB contra a chapa presidencial, sob a acusação de abuso de poder econômico e político nas eleições de 2014, foi rejeitada por 4 votos, de Gilmar, Admar Gonzaga, Napoleão Nunes Maia e Tarcísio Vieira, contra 3 votos, de Herman Benjamin, Rosa Weber e Luiz Fux.",Josias Oliveira,https://afolhabrasil.com.br/politica/dilma-entrara-na-justica-pra-anular-impeachment/,politica,2017-06-11,311,273,154,0,3,44,1,82,13,7,7,0,0,6,2.92308,1326,21.0,4.85714,0.00732601,0.15873,0.564103
2421,"Jornalista australiano destrói a imagem da Rio 2016: ""Favela olímpica,  mar fedorento,  dengue e bandidos"".  Richard Hinds,  jornalista do The Daily Telegraph ,  não poupou críticas à Vila Olímpica e fuzilou: ""É uma favela olímpica"".  (João Pedro Diniz  exclusivo para o Diário do Brasil) O artigo foi publicado hoje (26) Hinds disse: ""Nossos conterrâneos australianos não gostaram da tentativa do Comitê Organizador de substituir a tradicional Vila Olímpica por uma Favela Olímpica,  ao estilo Rio. Isso dará aos atletas a chance de experimentar as condições de vida de boa parte dos brasileiros,  para quem água encanada,  esgoto e paredes são opcionais extras"" ,  escreveu o colunista. O jornalista ainda detonou as condições do Velódromo (pista artificial que receberá provas de ciclismo),  que está com a pista suja e faz os ciclistas escorregarem,  e da poluída Baía da Guanabara,  onde serão realizadas as competições de vela. ""Alguns ciclistas já estão conseguindo parar de pé no velódromo,  e o cheiro do mar teve a classificação diminuída de ""corpo apodrecendo"" para ""saco de peixes esquecido no sol"" ,  escreveu. Com relação à segurança na cidade maravilhosa,  Hinds foi irônico: ""Eu e meus seis guarda-costas armados andamos tranquilamente pelos hotéis e pelas piscinas sem nenhuma ameaça significativa até agora"" Sobre o vírus Zika,  ele disparou: ""O Comitê Organizador me garantiu que,  após aplicação de repelente de mosquitos,  é perfeitamente seguro apreciar tudo o que o Rio tem a oferecer. Também me garantiram que todos os atletas roubados e sequestrados por bandidos armados serão soltos a tempo de disputarem suas competições"" ,  finalizou. leia também:",None,https://www.diariodobrasil.org/jornalista-australiano-destroi-a-imagem-da-rio-2016-favela-olimpica-mar-fedorento-dengue-e-bandidos/,sociedade_cotidiano,26/07/2016,310,257,180,3,1,47,1,71,16,12,4,3,0,17,5.88889,1341,28.5556,5.2179,0.0,0.237288,0.700389
383,"Hóspede cumprimenta Lula dentro de hotel: "" E aí ladrão ? "".  Moradora de Fortaleza surpreende Lula em hotel: ""Aparece safado ... bota tua cara na janela"".  É óbvio que temos que ter o mínimo de respeito com as pessoas, principalmente em ambientes públicos. Por mais que nossas opiniões sejam divergentes em relação a algum assunto, isso não nos dá o direito de ofender, xingar ou maltratar o próximo. Mas que esse fato foi engraçado [...] ahhh, isso foi. Seria trágico se não fosse cômico! Repare que Lula, ao lado do ex-ministro da Casa Civil, Jaques Wagner, caminha normalmente em um corredor de hotel, quando um dos hóspedes (sentado em uma poltrona) surpreende o ex-presidente e solta um grito: "" E aí ladrão ?!?! "" ... Lula olha imediatamente para o hóspede, mas é contido por Jaques Wagner, que coloca a mão em suas costas, como se quisesse dizer: ""Deixa pra lá,vamos embora"" O vídeo foi divulgado no Youtube pelo próprio internauta confira: leia também:",None,https://www.diariodobrasil.org/hospede-cumprimenta-lula-dentro-de-hotel-e-ai-ladrao/,tv_celebridades,14/01/2018,201,159,121,2,1,35,6,38,5,11,4,0,1,11,2.8,743,10.6,4.67296,0.00628931,0.219178,0.761006
830,"Há 10 anos, o antagonista Diogo Mainardi avisou: ""Lula é um homem medíocre ... um pelego oportunista"".  Vale a pena rever a entrevista do jornalista Diogo Mainardi para o programa do Jô, em 2007.  "" O Lula é um homem medíocre, é um pelego oportunista que age de acordo com as conveniência do momento. Ele é o espelho das nossas idéias mais regressivas, do atraso, do temperamento mais arcaico e retrógrado "" assista:",None,https://www.diariodobrasil.org/ha-10-anos-o-antagonista-diogo-mainardi-avisou-lula-e-um-homem-mediocre-e-um-pelego-oportunista/,tv_celebridades,04/09/2017,84,70,49,0,0,9,1,22,6,3,0,0,0,3,2.0,325,10.0,4.64286,0.0142857,0.290323,0.7
2697,"Teori poderá liberar inquéritos sobre Lula a qualquer momento. Caso irá para Curitiba.  Há exatos 30 dias,  Procuradores da Lava Jato pediram ao ministro do STF Teori Zavascki a devolução [para a 13a. Vara de Curitiba] dos inquéritos envolvendo o ex-presidente Lula.  Durante a manobra de Dilma para nomear Lula Ministro Chefe Casa Civil,  o petista passou a ter foro privilegiado e ao menos cinco investigações contra o ex-presidente foram enviadas para o STF. O sítio em Atibaia,  o tríplex no Guarujá e valores recebidos de empreiteiras são investigados nesses inquéritos. A petição foi enviada depois após o afastamento de Dilma do cargo de presidente. Integrantes da força-tarefa dizem que,  nesse caso,  o ministro está demorando mais do que o habitual para deliberar. Caso o processo seja liberado por Teori e enviado para a ""República de Curitiba"" ,  o juiz Federal Sérgio Moro cuidará desses documentos com muito carinho!",None,https://www.diariodobrasil.org/teori-podera-liberar-inqueritos-sobre-lula-a-qualquer-momento-caso-ira-para-curitiba/,politica,08/06/2016,167,151,105,0,2,22,1,47,4,2,6,0,0,2,1.77778,752,16.7778,4.98013,0.0,0.0869565,0.695364
465,"Teste nuclear da Coreia matou mais de 200 pessoas e radiação pode se espalhar. .  A TV japonesa Asahi informou que o último teste nuclear realizado na base de testes norte-coreana de Punggye-ri, nordeste do país, deixou mais de 200 vítimas fatais. No início de setembro, a Coréia do Norte detonou um dispositivo nuclear sob uma montanha. Especialistas avaliam ser uma bomba de hidrogênio , dez vezes mais poderosa do que as primeiras bombas atômicas lançadas no Japão no final da Segunda Guerra Mundial. Desde então, imagens de satélite revelaram que a montanha acima do local de testes já sofreu uma série de deslizamentos de terra resultantes de uma série de explosões. Fontes norte-coreanas disseram à TV Asahi que, inicialmente um dos túneis matou 100 trabalhadores e outras 100 pessoas que trabalhavam no resgate desses trabalhadores. Além disso, com a base de testes comprometida, o material radioativo deixado pela explosão corre um sério risco de causar um incidente internacional de grandes proporções. ""Se os detritos do teste chegarem à China, Pequim poderá entender isso como um ataque a seu país e uma provável guerra será praticamente inevitável."" disseram os especialistas.",None,https://www.diariodobrasil.org/teste-nuclear-da-coreia-matou-mais-de-200-pessoas-e-radiacao-pode-se-espalhar/,sociedade_cotidiano,13/12/2017,209,191,130,1,2,23,1,60,16,9,2,0,0,7,1.63636,974,17.3636,5.09948,0.0,0.301205,0.680628
